id,source,title,url,content,date,authors,image_url,scraped_at
eeddd0bab51b432a2e806783399a36e8,Cointelegraph,Bitcoin price on verge of breaking 10-week downtrend — Is $90K BTC next?,https://cointelegraph.com/news/bitcoin-price-on-verge-of-breaking-10-week-downtrend-is-90-k-btc-next," Bitcoin’s market structure is shifting back to bulls, increasing the chance of BTC price seeking new all-time highs. 
Bitcoin’s (BTC) price is off to a swift start in Q2, rallying by 5.53% to an intraday high of $87,333 on April 2. Currently, Bitcoin is emerging from a ten-week downtrend that began on Jan. 20 when the price peaked at $110,000. 
A decisive close above the trendline might lead to continued bullish momentum for Bitcoin in the coming days.
Bitcoin 1-day chart. Source: Cointelegraph/TradingView
Throughout March, spot traders on Binance and Coinbase held opposite stances in the market. Binance traders were aggressive BTC sellers, while Coinbase showed significant spot bids around the $80,000 price level. This dynamic contributed to the sideways price action during the majority of March. 
Fast forward to April, and spot traders on major exchanges have collectively turned bullish over the past three days. 
Binance, Coinbase spot buyers data. Source: Aggr.trade
Data from aggr.trade highlights that Coinbase and Binance spot bids are driving positive action for BTC. The buying pressure is particularly high on Coinbase, with spot bids increasing as high as $7.98 million over the past few hours. 
Likewise, Dom, a crypto markets analyst, pointed out that Bitcoin’s current rally is possibly due to Binance sellers tapering off. The analyst said, 
Related: Bitcoin breaks $86K as US tariff 'Liberation Day' risks 11% BTC price dip
From a technical perspective, Bitcoin has flipped an important resistance range between $84,000 and $85,000 into support. Likewise, the cryptocurrency has attained a bullish position above the 50-day, 100-day and 200-day exponentially moving averages (EMAs). 
Bitcoin 4-hour chart. Source: Cointelegraph/TradingView
However, based on the external liquidity levels between $87,700 and $88,700, which formed the previous highs, BTC prices might struggle to break this range immediately. Consolidation between the green box (as illustrated in the chart) is likely a net positive, which might fuel BTC’s $90,000 retest for the first time since March 7. 
On the flip side, an immediate correction to the current support at $84,000 and $85,000 could possibly discourage bulls, and short sellers might take control of price action. 
Bullish invalidation could be on the cards if BTC price closes below $85,000 over the next few days. 
With markets bracing for further market volatility ahead of President Trump’s  “Liberation Day” tariffs, Bitcoin price is expected to react further during today’s White House press conference at 4 pm Eastern Time. 
Related: Bitcoin price can hit $250K in 2025 if Fed shifts to QE: Arthur Hayes
This article does not contain investment advice or recommendations. Every investment and trading move involves risk, and readers should conduct their own research when making a decision.
",2025-04-03 13:48:04.503917,[],,2025-04-03T13:48:04.503917
942fb9cf9c89726e9026dc29172d530c,Cointelegraph,"Price analysis 4/2: BTC, ETH, XRP, BNB, SOL, DOGE, ADA, TON, LINK, LEO",https://cointelegraph.com/news/price-analysis-4-2-btc-eth-xrp-bnb-sol-doge-ada-ton-link-leo," Bitcoin bulls are trying to clear a critical overhead hurdle at $88,000. Will large-cap altcoins follow? 
Bitcoin (BTC) bulls have pushed the price above the $87,000 level even as US trade tariffs are slated to kick in on April 2. Bitcoin may remain volatile in the near term, but analysts remain bullish for the long term.
According to Fidelity analyst Zack Wainwright, Bitcoin is currently in an acceleration phase, which “can conclude with a sharp, dramatic rally” if history repeats itself. If that happens, Wainwright expects $110,000 to be the starting base of the next leg of the upmove.
Crypto market data daily view. Source: Coin360
BitMEX co-founder and Maelstrom chief investment officer Arthur Hayes said in a post that if the Federal Reserve pivots to quantitative easing, then Bitcoin could rally to $250,000 by year-end.
Could Bitcoin break above the $89,000 overhead resistance, starting a rally in select altcoins? Let’s analyze the charts of the top 10 cryptocurrencies to find out.
Bitcoin has risen close to the resistance line, where the sellers are expected to pose a solid challenge.
BTC/USDT daily chart. Source: Cointelegraph/TradingView
The flattening 20-day exponential moving average ($85,152) and the relative strength index (RSI) just above the midpoint signal the bears are losing their grip. That improves the prospects of a rally above the resistance line. If that happens, the BTC/USDT pair could climb to $95,000 and eventually to $100,000.
Alternatively, if the price turns down sharply from the resistance line and breaks below $81,000, it will suggest that the bears are back in the driver’s seat. The pair may then tumble to $76,606.
Ether (ETH) rebounded off the $1,754 support on March 31, signaling that the bulls are attempting to form a double-bottom pattern.
ETH/USDT daily chart. Source: Cointelegraph/TradingView
The bears will try to stall the relief rally at the 20-day EMA ($1,965). If the price turns down from the 20-day EMA, the possibility of a break below $1,574 increases. The ETH/USDT pair may then collapse to $1,550.
Contrarily, a break and close above the 20-day EMA opens the doors for a rise to the breakdown level of $2,111. If buyers pierce this resistance, the pair will complete a double-bottom pattern, starting a rally to the target objective of $2,468.
XRP’s (XRP) weak bounce off the crucial $2 support suggests a lack of aggressive buying by the bulls at the current levels.
XRP/USDT daily chart. Source: Cointelegraph/TradingView
That heightens the risk of a break below $2. If that happens, the XRP/USDT pair will complete a bearish head-and-shoulders pattern. This negative setup could start a downward move to $1.27. There is support at $1.77, but it is likely to be broken.
On the upside, a break and close above the 50-day SMA ($2.39) suggests solid buying at lower levels. The pair may then rally to the resistance line, where the bears are expected to mount a strong defense. A break and close above the resistance line signals a potential trend change.
BNB’s (BNB) recovery attempt stalled at the moving averages on April 1, indicating that the bears are selling on rallies.
BNB/USDT daily chart. Source: Cointelegraph/TradingView
The bears will try to strengthen their position by pulling the price below $587. If they can pull it off, the BNB/USDT pair could descend to the 50% Fibonacci retracement level of $575 and later to the 61.8% retracement of $559. The deeper the pullback, the greater the time needed for the pair to recover.
A break above the moving averages is the first sign that the selling pressure has reduced. The pair may rally to $644 and then to $686, which is likely to attract sellers.
Solana (SOL) is getting squeezed between the 20-day EMA ($132) and the $120 support, signaling a possible range expansion in the short term.
SOL/USDT daily chart. Source: Cointelegraph/TradingView
If the price breaks and closes above the 20-day EMA, it suggests that the buyers have overpowered the sellers. The SOL/USDT pair may rise to the 50-day SMA ($145) and, after that, to $180.
This positive view will be invalidated in the near term if the price turns down from the moving averages and breaks below $120. That could pull the price to $110, where the buyers are expected to step in.
Dogecoin (DOGE) remains pinned below the 20-day EMA ($0.17), indicating that the bears continue to sell on minor rallies.
DOGE/USDT daily chart. Source: Cointelegraph/TradingView
The first sign of strength will be a break and close above the 20-day EMA. The DOGE/USDT pair may climb to $0.21, which could act as a strong barrier. If buyers pierce the $0.21 resistance, the pair may rally to $0.24 and later to $0.29.
Sellers are likely to have other plans. They will try to defend the moving averages and pull the price below $0.16. If they manage to do that, the pair could descend to the $0.14 support. A break and close below the $0.14 level may sink the pair to $0.10.
Buyers are trying to push Cardano (ADA) back above the uptrend line, but the bears are likely to sell near the moving averages.
ADA/USDT daily chart. Source: Cointelegraph/TradingView
The downsloping 20-day EMA ($0.71) and the RSI just below the midpoint signal that bears have the edge. If the price turns down and breaks below $0.63, the ADA/USDT pair could plunge to $0.58 and thereafter to $0.50.
Buyers will have to drive and maintain the price above the 50-day SMA ($0.75) to signal a potential trend change in the near term. The pair could rally to $0.84, which may act as a hurdle. 
Related: Is Bitcoin price going to crash again?
Toncoin (TON) broke above the $4.14 resistance on March 1, but the bulls could not sustain the breakout.
TON/USD daily chart. Source: Cointelegraph/TradingView
A minor positive in favor of the bulls is that they have not allowed the price to slip much below $4.14. That increases the possibility of a break above the overhead resistance. The TON/USDT pair could rally to $5 and later to $5.50.
The 20-day EMA ($3.71) is the critical support to watch out for on the downside. If the support cracks, it will signal that the bulls are losing their grip. The pair may slide to the 50-day SMA ($3.48) and then to $2.81.
Chainlink (LINK) tried to rise above the 20-day EMA ($14.32) on April 1, but the bears held their ground.
LINK/USDT daily chart. Source: Cointelegraph/TradingView
Sellers will try to pull the price to the support line of the descending channel pattern, which remains the key short-term level to keep an eye on. If the price breaks below the support line, the LINK/USDT pair could descend to $10.
If buyers want to prevent the downside, they will have to push and maintain the price above the 50-day SMA ($15.47). If they manage to do that, the pair could rally to $17.50 and subsequently to the resistance line.
UNUS SED LEO (LEO) turned down from the overhead resistance of $9.90 and plunged below the uptrend line on March 30.
LEO/USD daily chart. Source: Cointelegraph/TradingView
However, the bears could not sustain the lower levels, and the bulls pushed the price back into the triangle on April 1. The recovery is expected to face selling at the 20-day EMA ($9.60). If the price turns down from the 20-day EMA and breaks below the uptrend line, it increases the risk of a fall to $8.
Instead, if the LEO/USD pair breaks above the 20-day EMA, it suggests that the markets have rejected the breakdown. A breakout and close above $9.90 will complete an ascending triangle pattern, which has a target objective of $12.04.
This article does not contain investment advice or recommendations. Every investment and trading move involves risk, and readers should conduct their own research when making a decision.
",2025-04-03 13:48:08.319496,[],,2025-04-03T13:48:08.319496
fc45de0f03f05ff71b8917c4e60f6ef1,Cointelegraph,Most opportune time to buy Bitcoin? Now — Bitwise CIO Matt Hougan explains why,https://cointelegraph.com/news/best-time-ever-to-buy-bitcoin-bitwise-matt-hougan," In an exclusive interview with Cointelegraph, the chief investment officer discusses Bitcoin’s risks, institutional adoption and why now could be the best time to invest. 
If you’ve ever wondered when is the right time to invest in Bitcoin (BTC), you won’t want to miss our latest interview with Matt Hougan. As the chief investment officer at Bitwise, Hougan provides an in-depth analysis, explaining why, from a risk-adjusted perspective, there has never been a more opportune time to buy Bitcoin.
In our discussion, Hougan lays out a compelling argument: Bitcoin’s early days were filled with uncertainty — technology risks, regulatory threats, trading inefficiencies, and reputational concerns. Fast forward to today, and those risks have significantly diminished. The launch of Bitcoin ETFs, adoption by major institutional investors, and even the US government’s strategic Bitcoin reserve have all cemented its place in the global financial ecosystem. 
“Bitcoin is only 10% of gold. So just to match gold, which I think is just a stopping point on its long-term journey, it has to ten-x from here,” he said. 
But that’s just the beginning. Hougan also touches on Bitcoin’s long-term price potential, why institutional adoption is about to accelerate, and how market fundamentals could push Bitcoin to new heights. 
“There's just too much structural long-term demand that has to come into this market against a severely limited new supply,”  he said.
Watch the full interview now on our YouTube channel, and don’t forget to subscribe! 
",2025-04-03 13:48:12.063909,[],,2025-04-03T13:48:12.063909
