id,source,title,url,content,date,authors,image_url,scraped_at
fc2145323cb61260e4baa66cc78d72d8,Cointelegraph,"California financial regulator warns of 7 new types of crypto, AI scams",https://cointelegraph.com/news/californian-regulator-warns-7-new-crypto-ai-scams," California’s Department of Justice says it took down 42 crypto scam websites in 2024 that haad stolen $6.5 million from users. 
A California financial regulator says users reported seven new types of crypto and AI scams that it hadn’t seen before through thousands of complaints in 2024. 
The California Department of Financial Protection and Innovation (DFPI) said in a March 10 statement that it received 2,668 complaints in 2024 and found seven types of scams they didn’t have on record yet, such as fake Bitcoin (BTC) mining schemes, where fraudsters offer fake investments in mining. 
The DFPI also received complaints about fake crypto gaming schemes, where users are encouraged to deposit funds only to have their wallets drained, and fraudsters offering fake jobs that require victims to transfer crypto and provide private information.
Source: California Department of Financial Protection and Innovation
Victims also reported the theft of private keys through fake airdrops, fake investment group scams in WhatsApp or Telegram, AI Investment scams offering unusually high returns and losing their crypto after interacting with certain sham websites. 
The AI industry experienced significant growth in 2024, reaching a market cap of $638 billion, according to Precedence Research. 
There was also a notable rise in crimeware-as-a-service (CaaS), where experienced hackers and cybercriminals sell their tools and services to less experienced offenders for a price.
DFPI Commissioner KC Mohseni said the regulator is urging caution when interacting with unknown platforms and to “verify website domains to avoid fraudulent imitations, and stay wary of crypto recovery scam sites.”
Through its partnership with the State, the DFPI says it shut down more than 26 fraudulent crypto websites and uncovered $4.6 million in user losses last year. 
California’s Department of Justice (DOJ) took down 42 crypto scam websites in 2024 that stole $6.5 million from victims, with an average loss per person of $146,306.
In a March 10 statement, the California DOJ said that because international fraudsters often carry out scams, they are difficult to prosecute and arrest.
Common threads among the scam websites were promises of high returns, no contact information, offers of prizes for signing up, and no listings on legitimate crypto industry websites such as CoinMarketCap, the California DOJ said. 
Related: Crypto lost to exploits, scams, hits $1.5B in February with Bybit hack: CertiK
A report from on-chain security firm Cyvers identified pig butchering schemes as one of the most costly in 2024, estimating the scam cost the industry over $5.5 billion across 200,000 identified cases. 
Meanwhile, blockchain security firm CertiK’s annual Web3 security report flagged crypto phishing attacks, which cost users $1 billion across 296 incidents, as the most significant security threat of 2024.
Magazine: Bitcoin’s odds of June highs, SOL’s $485M outflows, and more: Hodler’s Digest, March 2 – 8
",1741691707167,[],,2025-03-11T11:15:07.167446
c43f72eb84509cddc953e82486627eca,Cointelegraph,Here’s what happened in crypto today,https://cointelegraph.com/news/what-happened-in-crypto-today," Need to know what happened in crypto today? Here is the latest news on daily trends and events impacting Bitcoin price, blockchain, DeFi, NFTs, Web3 and crypto regulation. 
Today in crypto, the Chicago Mercantile Exchange (CME) Group announced the launch of Solana futures contracts in March. Meanwhile, global trade concerns continue pressuring investor sentiment, risking a potential Bitcoin correction below the key $75,000 support level. In addition, the US Securities and Exchange Commission has released a statement saying it does not view memecoins as securities.
The Chicago Mercantile Exchange (CME) Group, a globally recognized derivatives exchange, announced it will launch Solana (SOL) futures contracts on March 17, pending a review by United States financial regulators.
According to the Feb. 28 announcement, market participants will have access to micro contracts of 25 SOL or standard contract sizes of 500 SOL, and all contracts will be cash-settled. CME Group already provides futures and options contracts for Bitcoin (BTC) and Ether (ETH) to investors looking to hedge against the highly volatile nature of these digital assets.
The addition of Solana futures contracts gives traditional finance investors additional exposure to the crypto markets and provides the crypto markets with fresh capital injections that should support prices.
CME open interest on derivatives contracts quarter-by-quarter 2024. Source: CME Group
Bitcoin risks more downside if it loses a “key” $75,000 support amid growing concerns over a potential trade war between the United States and China.
Bitcoin’s (BTC) price has fallen more than 6.5% during the past 24 hours to sink below a low of $78,197, which was last seen on Nov. 10, 2024, Cointelegraph Markets Pro data shows.
Analysts attribute the current decline to macroeconomic concerns related to a potential trade war between the US and China caused by US President Donald Trump’s decision to impose import tariffs.
BTC/USD, 1-year chart. Source: Cointelegraph
These macroeconomic concerns were the main reason for Bitcoin losing the $80,000 support, according to Ryan Lee, chief analyst at Bitget Research.
The analyst told Cointelegraph:
Still, some analysts are concerned that Bitcoin’s correction may see the world’s first cryptocurrency revisit $70,000.
Based on its correlation with the global liquidity index, Bitcoin’s right-hand side (RHS), which marks the lowest bid price someone is willing to sell the currency for, may fall below $70,000 around the end of February, after it peaked near $110,000 in January.
The US Securities and Exchange Commission says it does not view memecoins as securities but warned any fraudulent tokens could still be subject to enforcement actions by other regulators.
The agency’s Division of Corporation Finance said in a Feb. 27 statement that, in its view, memecoins “do not involve the offer and sale of securities under the federal securities laws” and “are akin to collectibles.”
Source: David Sacks
“As such, persons who participate in the offer and sale of meme coins do not need to register their transactions with the Commission,” the SEC said.
It added that memecoin buyers and holders wouldn’t be protected by US securities laws but said the fraudulent offer and sale of memecoins “may be subject to enforcement action or prosecution by other federal or state agencies.”
",1740780816989,[],,2025-02-28T22:13:36.989672
3271329d1e6b2ee41a54e55a029001bf,Cointelegraph,Here’s why chasing trends can be a costly mistake: X Spaces with VCs,https://cointelegraph.com/news/heres-why-chasing-trends-can-be-a-costly-mistake-x-spaces-with-vcs," DePIN, decentralized AI, the shift from EVM blockchains and regulatory changes under the new US administration are key trends to follow in 2025. And venture capitalists already took a position. 

Restructuring business models in traditional organizations, AI is increasingly adopted in Web3 as well, with new integrations announced each day. Is this a lasting trend that will provide value and opportunities for years to come, or just another passing hype?
Cointelegraph Accelerator recently hosted a roundtable discussion on X Spaces, bringing together venture capitalists to find an answer. Nikola Santoni, partner at Lemniscap; Ivan Li, founding partner at Comma3 Ventures and Michael Zajko, co-founder of Lattice, shared insights on the current state of the crypto investments, key trends and factors that will shape the landscape in 2025.
🔥 Missed our Web3 & crypto AMA? Here’s the TL|DR:✅ Top industry verticals for 2025✅ Most promising startups to watch✅ Biggest barriers to mass adoption🎙️ Catch the recap our X Spaces w/ @comma3vc, @Lemniscap & @MikeZajko🔗 Listen now: https://t.co/qNHr1rvNiD
Nikola Santoni began by emphasizing the importance of assessing future demand rather than chasing current trends. “Obviously, the intersection of crypto and AI, with AI agents, has accelerated tremendously, which is impossible to ignore. But what stands out is how quickly the narratives and attention spans are changing, from retail investors to the media to institutional investors. This is what we need to be aware of when investing.”
Shedding light on Lemniscap’s approach, Santoni said the company focuses on identifying natural market demand and teams with potential for product development. “We tend to build conviction very early on. A key consideration is whether the product you originally envisioned makes sense in the long run,” he stated.
Agreeing on the point, Michael Zajko said, “To be successful, you need to invest before something becomes a hot trend, not after.” He noted that venture investments typically have a 5-7-year timeline and pointed to some examples like DeFi Summer, where investing at the peak would have meant missing out on earlier opportunities like Uniswap and Aave.
""We are investing in something that may not be available for several years. This trend has played out year after year with DeFi, NFTs, gaming and now decentralized physical infrastructure networks (DePIN). We have been big proponents of DePIN, and there are many exciting projects,” Zajko explained, continuing: “But the path to market and token launch for a really high-quality project is much longer because they’re using real-world infrastructure. Some of the DePIN tokens are coming to market this year, and there’s going to be a lot of exciting opportunities in that space.”
Ivan Li echoed the same sentiment, saying, “It’s risky to chase all the chains. If you’re a trader in the open market, you can chase these narrative changes in the short term because there’s a lot of liquidity. But in primary investments, there is no liquidity, so it is a very risky game. The long timelines - three years to TGE and another year for lock-ups and vesting - only add to the risk. The key is to invest before a project gets off the ground.”
Li said Comma3 Ventures doesn’t see a bright future for EVM-based blockchains and keeps the focus on somewhere else. “I suggest everyone take a closer look at Move-based blockchains like SUI. If you compare SUI to EVM, it’s like today’s Tesla to Ferrari 30 years ago. Our portfolio at Comma3 Ventures currently covers about 85-90% of the total value locked up in the entire SUI ecosystem.”
Zajko mentioned that the excitement around AI is largely due to its rapid development within Web2, but most AI-related projects in crypto today take a simplistic approach. “It’s a good way to speculate, and frankly, there’s still a very strong product-market fit in crypto for anything you can speculate on,” he said.
“What stands out to me is that developers are taking a more cautious approach. I think they’re looking at what actually works and delivers long-term value rather than just launching a token for retail speculation. A lot of these projects won’t come out right away, but I do expect to see more advanced AI agents this year that do things that aren’t just tweeting,” Zajko added.
According to the co-founder, AI can be divided into two main areas: “Enterprise AI includes decentralized compute projects like io.net and Render Network. Then you have the more retail-focused projects that are still in development. And there are a number of more platform-oriented projects that haven’t launched tokens on the enterprise side, like Ritual or Sentient. So I would expect to see a reemergence of that category. They’re coming out in the second half of the year, and their tokens should bring new energy to decentralized AI.”
Li emphasized the double-edged nature of regulation, saying, “Without a clear legal framework, there will be issues with AML, taxes and even the ability to take innovative risks within a proper structure, which is a huge risk for founders and investors. On the other hand, regulation also opens the door to institutional capital, even from conservative sources such as pension funds.”
For Li, regulation is also a matter of global competition: ""It's a kind of game theory between countries. If the US regulates crypto and collects taxes, but the rules are too restrictive, people will move and innovate elsewhere. We could have problems with entrepreneurs leaving, and that's something to consider.""
Zajko sees positive changes in the industry, especially with a more crypto-friendly approach from the new U.S. administration: ""With the new administration and new members of the SEC, and with enforcement actions like those against OpenSea and Coinbase being dropped, teams are starting to go back to the tactics and strategies they've always wanted to use, ones that are really beneficial to the space — like token sales, which are what made crypto. And teams are going back to them and selling to retail participants at attractive entry prices.""
He highlighted the increasing institutional adoption of Bitcoin, saying, ""You're already seeing government reserves and government treasuries being proposed to deposit in Bitcoin. The people who are making these decisions right now tend to be from an older generation. It's not so much that they need to be convinced; it's just that over time, they will pass out of power and younger people who are already comfortable with digital assets will take over. Whether the current leadership eventually embraces digital assets or simply transitions out of their roles, the outcome seems inevitable.""
""It's just a matter of when, not if,"" Zajko concluded.
Disclaimer. Cointelegraph does not endorse any content or product on this page. While we aim at providing you with all important information that we could obtain in this sponsored article, readers should do their own research before taking any actions related to the company and carry full responsibility for their decisions, nor can this article be considered as investment advice. 
",1741691717084,[],,2025-03-11T11:15:17.084050
02d5481bce5fc5472818919ca2347103,Cointelegraph,"Price analysis 3/10: SPX, DXY, BTC, ETH, XRP, BNB, SOL, DOGE, ADA, PI",https://cointelegraph.com/news/price-analysis-3-10-spx-dxy-btc-eth-xrp-bnb-sol-doge-ada-pi," Bitcoin risks a fall below the critical $78,258 support, opening the doors for a further fall to $73,777. 
Bitcoin (BTC) bulls tried to push the price above $85,000, but the bears held their ground. A minor positive is that larger investors seem to be accumulating at lower levels. 
Research firm Santiment said in a post on X that wallets with 10 BTC or more have bought roughly 5,000 Bitcoin since March 3. The researchers added that if buying by the large players continues, the second half of March could be much better than the recent performance of Bitcoin.
However, not everyone is bullish on Bitcoin in the near term. BitMEX co-founder and Maelstrom chief investment officer Arthur Hayes said in a post on X that Bitcoin could retest $78,000 and even below $75,000. 
He added that Bitcoin’s price action could become violent if it drops in the $70,000 to $75,000 zone as a lot of Bitcoin open interest is stuck in that range.
Daily cryptocurrency market performance. Source: Coin360
Meanwhile, short-term investor sentiment remains bearish. According to CoinShares data, cryptocurrency exchange-traded products (ETPs) witnessed $876 million in outflows last week, taking the four-week total outflows to $4.75 billion. Bitcoin ETPs recorded the lion’s share of outflows at $756 million.
Can Bitcoin start a recovery from the current levels, pulling altcoins higher? Let’s analyze the charts to find out.
The S&P 500 Index (SPX) turned down from the 20-day exponential moving average (5,900) on March 3 and broke below the 5,773 support on March 6, completing a double-top pattern.
SPX daily chart. Source: Cointelegraph/TradingView
The index bounced off the 5,670 level on March 7, but the bears successfully defended the breakdown level of 5,773. The index turned down and broke below the 5,670 support on March 10, opening the doors for a fall to 5,400.
Buyers will have to push and sustain the price above 5,773 to suggest solid demand at lower levels. The index could then rise to the 20-day EMA, which is again expected to act as a strong resistance. 
The US Dollar Index (DXY) turned down sharply on March 3 and continued lower, breaking below the 105.42 support on March 5.
DXY daily chart. Source: Cointelegraph/TradingView
The fall below 105.42 suggests that the breakout above 108 may have been a bull trap. Buyers are trying to defend the 103.73 level, but the relief rally is expected to face selling at the 20-day EMA (106.03). 
If the price turns down from the current level or the 20-day EMA, it will suggest a negative sentiment. That increases the risk of a break below 103.37. If that happens, the index may plunge to 101.
Buyers have an uphill task ahead of them. They will have to push and maintain the price above the 20-day EMA to clear the path for a rally to 108.
BTC price broke below the support line of the symmetrical triangle pattern on March 9, indicating that the sellers have overpowered the buyers.
BTC/USDT daily chart. Source: Cointelegraph/TradingView
The bulls are trying to defend the $81,500 to $78,258 support zone, but the recovery attempt faced selling at the breakdown level on March 10. That suggests the bears are trying to flip the support line into resistance. If the price skids below $78,258, the BTC/USDT pair could collapse to $73,777.
Buyers are likely to have other plans. They will try to defend the support zone and push the price above the 20-day EMA ($88,605). If they manage to do that, the pair could rally to the resistance line.
Ether (ETH) fell and closed below the vital $2,111 support on March 9, signaling the start of the next leg of the downtrend.
ETH/USDT daily chart. Source: Cointelegraph/TradingView
Buyers tried to push the price above $2,111 on March 10, but the long wick on the candlestick suggests solid selling by the bears. There is minor support at $1,993, but if the level cracks, the ETH/USDT pair could sink to $1,750 and eventually to $1,550.
Related: Ethereum price bottom? $1.8B in ETH leaves exchanges, biggest outflow since 2022
The bulls will have to push and maintain the price above the 20-day EMA ($2,329) to signal that the break below $2,111 may have been a bear trap. The pair could then rally to the 50-day SMA ($2,711).
XRP (XRP) continues to slide toward the crucial support at $2, suggesting that the bears are trying to seize control.
XRP/USDT daily chart. Source: Cointelegraph/TradingView
A break and close below $2 will complete a bearish head-and-shoulders pattern. There is minor support at $1.77, but the level is likely to be broken. If that happens, the XRP/USDT pair could plunge toward $1.28.
Related: Is XRP price going to crash again?
Contrary to this assumption, a solid bounce off $2 will signal that the bulls are vigorously defending this level. The 20-day EMA ($2.40) is likely to act as a stiff hurdle, but if the bulls prevail, the pair could reach $2.80.
BNB’s (BNB) failure to rise above the 20-day EMA ($601) attracted another round of selling on March 9, pulling the price below $546.
BNB/USDT daily chart. Source: Cointelegraph/TradingView
The down-sloping moving averages and the relative strength index (RSI) in the negative zone suggest that the path of least resistance is to the downside. If the price maintains below $546, the BNB/USDT pair could plummet to $500. Buyers are expected to aggressively defend the zone between $500 and $460.
The 20-day EMA is the first significant resistance to watch out for on the upside. If this level gets taken out, the pair could rise to the 50-day SMA ($633). A close above the 50-day SMA signals a short-term trend change.
Solana (SOL) broke below the uptrend line on March 9 and reached the strong support zone between $120 and $110.
SOL/USDT daily chart. Source: Cointelegraph/TradingView
The bulls are expected to fiercely defend the support zone, but the relief rally could face selling at the 20-day EMA ($150). If the price turns down sharply from the 20-day EMA, the $110 level will be at risk of breaking down. If that happens, the SOL/USDT pair could decline to $100 and later to $80.
Instead, if the price rises from the current level and breaks above the 20-day EMA, it will suggest solid buying near the support zone. The pair could then climb to the 50-day SMA ($188).
Dogecoin (DOGE) fell below the $0.18 support on March 9, indicating the resumption of the downtrend.
DOGE/USDT daily chart. Source: Cointelegraph/TradingView
The down-sloping moving averages and the RSI in the oversold territory suggest that bears have the upper hand. The 20-day EMA ($0.21) is the critical overhead resistance to watch out for. If the price turns down sharply from the 20-day EMA, the DOGE/USDT pair could sink to $0.14.
Alternatively, a break and close above the 20-day EMA will be the first sign that the selling pressure is reducing. The pair could climb to the 50-day SMA ($0.26), which may also act as a stiff resistance.
Cardano (ADA) fell below the moving averages on March 8, indicating aggressive selling by the bears.
ADA/USDT daily chart. Source: Cointelegraph/TradingView
Both moving averages have started to turn down, and the RSI has slipped into negative territory, indicating that the bears have a slight edge. The support on the downside is at $0.58 and then $0.50.
Any relief rally is likely to face selling at the moving averages. Buyers will have to push and maintain the price above the moving averages to signal a comeback. The ADA/USDT pair could then rise toward $1.02.
Pi (PI) fell to the 61.8% Fibonacci retracement level of $1.20 on March 9, indicating that the bears have kept up the pressure.
PI/USDT daily chart. Source: Cointelegraph/TradingView
Buyers are trying to start a recovery, but the long wick on the March 10 candlestick shows selling at higher levels. That increases the risk of a break below $1.20. If that happens, the PI/USDT pair could plunge to the 78.6% retracement level of $0.72.
Time is running out for the bulls. To prevent more downside, they will have to quickly push the price above the $2 overhead resistance. If they do that, it will suggest that the correction may be over.
This article does not contain investment advice or recommendations. Every investment and trading move involves risk, and readers should conduct their own research when making a decision.
",1741691719948,[],,2025-03-11T11:15:19.948338
