id,source,title,url,content,date,authors,image_url,scraped_at
d4207d6466da29a8be0d9cdc4a490201,Cointelegraph,Bitcoin price bounces 4% as data gives '89% chance' stocks bottom is in,https://cointelegraph.com/news/bitcoin-price-bounces-4-data-89-chance-stocks-bottom-is-in," Bitcoin joins US stock futures in a relief rally after a bruising US trading session sent BTC price action to new four-month lows and punished stocks. 
Bitcoin (BTC) rebounded above $81,000 on March 11 as US stocks’ futures sought relief from a brutal sell-off.
BTC/USD 1-hour chart. Source: Cointelegraph/TradingView
Data from Cointelegraph Markets Pro and TradingView showed daily BTC price gains approaching 4%.
New four-month lows had accompanied the previous day’s Wall Street trading session as recession fears sent risk-asset investors fleeing.
The S&P 500 and Nasdaq Composite Index finished the day down 2.7% and 4%, respectively. At the time of writing, Nasdaq 100 futures had recovered around 0.4% from a trip to their lowest levels since September 2024.
Commenting, trading resource The Kobeissi Letter suggested that markets had entered an unsustainable downtrend.
“Are we overdue for a massive short squeeze?” it queried in a thread on X, noting risk-asset sentiment in “extreme fear” territory.
Nasdaq 100 futures 1-day chart. Source: Cointelegraph/TradingView
Kobeissi and others referenced unusually high readings from the VIX volatility index while making the case for a sustained recovery.
“$VIX has only been higher 11% of the time, going back to 1990,” network economist Timothy Peterson, creator of several Bitcoin price forecasting tools, continued.
VIX volatility index. Source: Timothy Peterson/X
Bitcoin thus saw some much-needed upside on short timeframes after reaching $76,600 on Bitstamp.
Related: Biggest red weekly candle ever: 5 things to know in Bitcoin this week
“$BTC just had a bullish divergence on the 4H timeframe,” trader Cas Abbe said while analyzing relative strength index (RSI) signals. 
BTC/USD 4-hour chart with RSI data. Source: Case Abbe/X
Previously, trader and analyst Rekt Capital told X followers to watch for similar RSI cues from the daily chart to confirm a more sustainable BTC price comeback.
Zooming out, other popular crypto market participants remained gloomy. Among them was the pseudonymous X trader HTL-NL, who concluded that BTC/USD was unlikely to match all-time highs.
BTC/USDT 1-day chart. Source: HTL-NL/X
“Before anyone of you think this is specifically happening in crypto: it’s not,” another of his latest posts said alongside a chart of S&P 500 futures. 
S&P 500 futures 1-day chart. Source: HTL-NL/X
This article does not contain investment advice or recommendations. Every investment and trading move involves risk, and readers should conduct their own research when making a decision.
",2025-03-11 12:15:57.599797,[],,2025-03-11T12:15:57.599797
d88f8bef61b870ecb5f50d0d0b486178,Cointelegraph,The strategic crypto reserve will fuel ecosystem growth,https://cointelegraph.com/news/the-strategic-crypto-reserve," The US strategic crypto reserve featuring Bitcoin, Ether, XRP, Solana and Cardano legitimizes these platforms, enabling ecosystem growth, investment and innovation across DeFi, infrastructure and blockchain gaming. 
Opinion by: Tim Haldorsson, founder of Lunar Strategy
When US President Donald Trump announced the US strategic crypto reserve on March 2, the immediate focus fell on the price surges of the included coins. Behind the market excitement lies a much bigger story that extends far beyond the named assets themselves. 
The real opportunity lies not in holding Bitcoin (BTC), Ether (ETH), XRP (XRP), Solana (SOL) and Cardano (ADA) — it’s in building on these newly legitimized platforms.
This government endorsement creates fertile ground for an entire ecosystem of projects, unleashing innovation across multiple sectors while creating investment opportunities that could define the next wave of blockchain adoption.
The strategic reserve announcement fundamentally changed the risk profile for projects building on these networks. Developers quietly building on Ethereum, Solana and Cardano now find themselves on government-approved foundations. This validation removes significant uncertainty — a crucial factor for attracting users and capital.
When a nation plans to hold these assets in reserve, it signals a long-term commitment to their viability. For projects building on these networks, this increases confidence that their underlying platform won’t face existential regulatory threats. Infrastructure projects particularly stand to benefit; layer-2 scaling solutions for Ethereum, developer tooling for Solana and interoperability solutions for Cardano can now operate with greater certainty about their foundation’s future.
The early evidence already supports this shift. After the announcement, Cardano’s ecosystem saw renewed attention, with significant whale accumulation and increased trading volume across its decentralized finance (DeFi) protocols. Projects such as Minswap and Liqwid Finance experienced growing interest as users gained confidence in the network’s long-term viability. Ethereum and Solana ecosystems are seeing similar effects, with capital flowing to projects that leverage their unique strengths.
Not all projects will benefit equally from this validation. Specific sectors are positioned to capture disproportionate growth as retail and institutional investors recalibrate their approach to these now-endorsed chains.
DeFi applications stand out as immediate beneficiaries. With multiple networks now government-backed, crosschain DeFi protocols that facilitate liquidity between Ethereum, Solana and Cardano are seeing renewed interest. The government’s implicit endorsement of multiple chains reinforces the vision of a multichain future rather than a winner-take-all scenario.
Infrastructure projects that connect these networks will also thrive. Crosschain bridges, already vital for a fragmented blockchain landscape, become even more critical when multiple networks have official backing. Projects building on identity solutions could also see significant interest — these government-approved networks make ideal foundations for digital identity systems requiring trust and stability.
Recent: Does XRP, SOL or ADA belong in a US crypto reserve?
Finally, the blockchain gaming sector, which had already shown strong growth with 7.4 million daily active wallets by the end of 2024, could accelerate as developers flock to these legitimized platforms. Games built on Solana’s speed or Cardano’s security can point to government endorsement as a credibility booster when seeking partners or users.
For investors looking to capitalize on this ecosystem growth, several key metrics separate promising projects from mere speculation.
Total value locked (TVL) provides a window into genuine usage and trust. Projects showing significant TVL growth after the announcement demonstrate real traction. Developer activity remains another critical indicator: Ethereum remains the most important developer ecosystem, with thousands of active monthly contributors. At the same time, Solana experienced the fastest developer growth in 2024, particularly in emerging markets like India.
User adoption metrics tell an equally important story. Daily active wallets, transaction volumes and community growth reveal whether a project captures actual market share or generates hype. Strong partnerships also signal project strength — those securing collaborations with established institutions gain credibility and distribution channels.
The most promising projects combine these metrics with robust security measures and regulatory compliance — increasingly important factors now that these networks have government attention. Projects anticipating and addressing compliance requirements position themselves to benefit from institutional adoption.
Historically, government endorsements have led to increased institutional investment. The strategic reserve announcement could recalibrate how venture capital flows through the crypto ecosystem if this pattern holds. Venture capitalists, who were previously cautious about regulatory uncertainty, now have more precise signals about what networks have an unofficial blessing.
We may see venture firms double down on projects building on Ethereum, Solana and Cardano at the expense of alternative chains. New dedicated funds focusing specifically on government-endorsed networks could emerge, similar to how funds reorient around policy shifts in other sectors.
This shift extends beyond where capital flows and influences what types of projects are funded. Compliance-focused startups, infrastructure plays and enterprise-ready applications will attract more attention than purely speculative projects. VCs will increasingly favor teams that understand how to navigate the intersection of innovation and regulation.
For startups, this creates both opportunity and challenge. Building on these endorsed networks offers a more straightforward path to funding, but expectations around compliance and security will rise accordingly. The days of raising millions on concepts alone are giving way to the demand for solid execution and regulatory awareness.
With multiple chains now part of the strategic reserve, interoperability solutions take center stage. Projects enabling seamless movement between Ethereum, Solana and Cardano stand to benefit tremendously from this new multichain reality.
Crosschain bridges like Wormhole, initially connecting Ethereum and Solana, will likely expand to include Cardano as the demand for connectivity between all endorsed networks grows.
Protocols facilitating crosschain governance or identity will similarly find increased relevance as assets and users flow between networks.
The government’s endorsement of multiple chains effectively validates the multichain thesis — that different networks serve different use cases rather than one blockchain dominating all activity. This creates space for infrastructure that connects these specialized systems into a cohesive whole.
The effects of this government endorsement will unfold over multiple time horizons — the immediate price rallies and attention spikes we’ve already witnessed. The more substantial ecosystem growth will develop over months and years.
Expect new project announcements and funding rounds in the next three to six months, explicitly citing the strategic reserve to validate their approach. Development activity on these networks will accelerate as previously hesitant teams about regulatory risk jump in.
Within a year, we’ll likely see the first major institutional products built on these networks launch with formal regulatory approval. The venture funding deployed now will begin producing tangible applications across DeFi, identity, gaming and enterprise sectors.
By the two-to-three-year mark, if historical patterns from other government-validated technologies hold, these blockchain ecosystems could become mainstream infrastructure, extending far beyond their current use cases. As the internet grew from a government project to a commercial ecosystem, these networks could evolve from reserve assets to fundamental digital infrastructure.
The strategic reserve announcement might begin a new phase of worldwide blockchain adoption for investors, developers and users.
Opinion by: Tim Haldorsson, founder of Lunar Strategy. 
This article is for general information purposes and is not intended to be and should not be taken as legal or investment advice. The views, thoughts, and opinions expressed here are the author’s alone and do not necessarily reflect or represent the views and opinions of Cointelegraph.
",1741691692943,[],,2025-03-11T11:14:52.943342
f7e63717003ecd0443095326d814c17a,Cointelegraph,"Deutsche Boerse to launch Bitcoin, Ether institutional custody: Report",https://cointelegraph.com/news/deutsche-boerse-to-launch-btc-eth-services-to-institutions-report," Deutsche Boerse’s Clearstream to offer crypto custody and settlement services for institutional clients, expanding its Bitcoin and Ether offerings in 2025. 
Deutsche Boerse’s trading unit, Clearstream, is preparing to launch cryptocurrency custody and settlement services for institutional clients in 2025 amid increasing demand for regulated digital asset infrastructure.
The German exchange group plans to offer Bitcoin (BTC) and Ether (ETH) custody to its more than 2,500 institutional clients, with services expected to begin in April, according to a Bloomberg report on March 11.
Clearstream will provide these digital asset services through Crypto Finance AG, a Switzerland-based subsidiary in which Deutsche Boerse acquired a majority stake in 2021.
Deutsche Boerse’s trading unit also aims to launch support for other cryptocurrencies and diversified services such as staking, lending and brokerage capabilities.
“With this offering, we are creating a one-stop shop around custody, brokerage and settlement,” Jens Hachmeister, head of issuer services and new digital markets at Clearstream, told Bloomberg.
The move aligns with a growing institutional push toward regulated crypto services in Europe following the implementation of Markets in Crypto-Assets Regulation (MiCA), which went into full effect for crypto asset service providers on Dec. 30, 2024.
The institutional offering came nearly two months after Boerse Stuttgart Digital Custody became Germany’s first crypto asset service provider to receive a full license under MiCA, Cointelegraph reported on Jan. 17.
Boerse Stuttgart’s license was part of the firm’s efforts to become a regulated infrastructure provider for banks, brokers and asset managers.
Related: EU MiCA rules pose ‘systemic’ banking risks for stablecoins — Tether CEO
While MiCA is widely viewed as a positive step for global crypto regulation, some industry experts worry about potential regulatory overreach that could impact retail investors and drive crypto firms out of Europe.
While the regulation is a significant step toward a more mature industry, it also seeks to identify the “weak points of control” in the crypto space, which could mean more scrutiny for retail investors and the end-users of crypto platforms, according to Dmitrij Radin, the founder of Zekret and chief technology officer of Fideum, a regulatory and blockchain infrastructure firm focused on institutions.
“Retail users will be way more obligated to provide information, data which will be screened. They will be accounted for. Most Europeans will see taxation,” Radin told Cointelegraph.
Related: 20% of Gen Z, Alpha sees crypto as retirement alternative: Report
The regulation also raises the possibility of enforcement actions against blockchain protocols that fail to comply with MiCA standards. European governments may pursue legal cases against noncompliant platforms during the early implementation phase.
Other blockchain regulatory experts fear that MiCA will introduce consolidation among crypto firms with limited capital, leading to a potential crypto firm exodus to the Middle East due to more lenient regulations.
Magazine: SEC’s U-turn on crypto leaves key questions unanswered
",1741691695652,[],,2025-03-11T11:14:55.652719
