id,source,title,url,content,date,authors,image_url,scraped_at
ec1ae19103b2dc74b4b1844b304a22a0,Cointelegraph,Arthur Hayes loves tariffs as printed money pain is good for Bitcoin,https://cointelegraph.com/news/arthur-hayes-donald-trump-tariffs-bitcoin-price-pump," Arthur Hayes says that tariffs will correct “global imbalances,” which will positively impact Bitcoin's price over the medium term. 
BitMEX co-founder Arthur Hayes says US President Donald Trump's tariffs may rattle the global economy in some ways, but that same disruption could be exactly what Bitcoin needs to rally.
“Global imbalances will be corrected, and the pain papered over with printed money, which is good for BTC,” Hayes said in an April 3 X post.
“Some of y'all are running scurred, but I LOVE TARIFFS,” Hayes said. 
His comments come just a day after it was announced that the Trump administration will hit all countries with a 10% tariff starting April 5, with some countries facing even larger rates, such as China facing a 34% tariff, the European Union 20%, and Japan 24%. 
Hayes explained that tariffs positively impact Bitcoin's (BTC) price for several reasons. 
Bitcoin is trading at $83,150 at the time of publication. Source: CoinMarketCap
One of them, he said, is the “weakening” of the US Dollar Index (DXY), as overseas investors continue to sell off US stocks and “bring money home.” 
April 3 marked “the largest single-day point loss for the Nasdaq 100 in history,” according to the trading resource account The Kobeissi Letter.
“The index lost a total of -1060 points and came just 1.5% away from triggering the first circuit breaker since March 2020,” The Kobeissi Letter said.
""This is good for BTC and gold over the medium term.""
Hayes also said that the stringent tariff placed on China may weaken the yuan (CNY). “With a 65% effective tariff levied, China could respond by allowing CNY to weaken past 8.00,” Hayes said. 
A weakening yuan may force the hand of Chinese investors to look at riskier assets such as Bitcoin to preserve their wealth.
Meanwhile, Hayes said that “we need Fed easing,” noting that the two-year Treasury yield “dumped” following the tariff announcement. 
Related: Bitcoin sales at $109K all-time high 'significantly below' cycle tops — Glassnode
He explained this as a signal that markets expect the Federal Reserve to cut rates and potentially restart quantitative easing (QE) to offset the negative economic impact. 
Fed rate cuts increase liquidity, also making riskier assets like crypto more attractive to investors.
Source: Arthur Hayes
Meanwhile, Jeff Park, head of alpha strategies at Bitwise Invest, has long argued that Trump's tariffs will ultimately benefit Bitcoin.
He said on Feb. 3 that in a “world of weaker dollar and weaker US rates…risk assets in the US will fly through the roof beyond your wildest imagination.”
“Bookmark this and revisit as the financial war unravels, sending Bitcoin violently higher,” Parks said on Feb. 3.
Magazine: XRP win leaves Ripple a 'bad actor' with no crypto legal precedent set
This article does not contain investment advice or recommendations. Every investment and trading move involves risk, and readers should conduct their own research when making a decision.
",2025-04-04 11:26:58.056159,[],,2025-04-04T11:26:58.056159
561746d213f142f0b92b01cd7f85d194,Cointelegraph,"Altcoins are set for one last big rally, but just a few will benefit — Analyst",https://cointelegraph.com/news/altcoins-one-last-rally-network-activity-big-signal-analyst," Real Vision's Jamie Coutts is watching June for a potential altcoin market recovery but says traders should treat network activity as the “north star” for crypto investing. 
Altcoins may have just one last rally this cycle, but only those with real utility and strong network activity will see price gains, according to an analyst. 
“I think there will be one more breadth thrust from altcoins. The question is, is it a sustained rally that we will see for six to twelve months,” Real Vision chief crypto analyst Jamie Coutts told Real Vision co-founder Raoul Pal on an April 3 X livestream.
“At this stage, I am not too sure, but I do believe that quality altcoins where activity returns, activity drives prices …we will definitely see a recovery in some of these more high-quality names,” Coutts said.
Cointelegraph reported in January that there were over 36 million altcoins in existence. However, Ethereum still holds the majority share of total value locked (TVL) with 55.56%, followed by Solana (6.89%), Bitcoin (5.77%), BNB Smart Chain (5.68%), and Tron (5.54%), according to CoinGecko data.
Coutts said traders should watch where the network activity “is gravitating” and use that as their “north star” for how to trade in crypto, adding he sees an altcoin market upswing within the next two months. 
On March 28, Coutts told Cointelegraph that Bitcoin could reach all-time highs before the end of Q2 regardless of whether there is more clarity on US President Donald Trump's tariffs and potential recession concerns.
The total crypto market cap is down around 8% over the past 30 days. Source: CoinMarketCap
Blockchain network activity across the board has recently experienced sharp declines amid a broader crypto market downturn. On Feb. 21, Cointelegraph reported that the number of active addresses on the Solana (SOL) network fell to a weekly average of 9.5 million in February, down nearly 40% from the 15.6 million active addresses in November 2024.
Meanwhile, several key indicators the crypto industry uses to determine an incoming altcoin season suggest it's still nowhere in sight.
Capriole Investments’ Altcoin Speculation Index has dropped to 12%, down 53% since Dec. 25, the same period during which Ether fell 49% from $3,490, according to CoinMarketCap data.
Related: When will altseason arrive? Experts reveal what's holding back altcoins
CoinMarketCap’s Altcoin Season Index, which measures the top 100 cryptocurrencies against Bitcoin’s performance over the past 90 days, is reading a score of 14 out of 100, leaning toward a more Bitcoin-dominated market, referring to it as “Bitcoin Season.”
The Altcoin Season Index Chart is sitting at 14 at the time of publication. Source: CoinMarketCap
However, while Bitcoin dominance — a level often watched for retracements that signal an altcoin season — sits at 62.84%, some analysts argue it’s no longer as relevant as a signal for altcoin season.
CryptoQuant CEO Ki Young Yu recently said that Bitcoin Dominance “no longer defines altseason — trading volume does.”
Magazine: New 'MemeStrategy' Bitcoin firm by 9GAG, jailed CEO's $3.5M bonus: Asia Express
This article does not contain investment advice or recommendations. Every investment and trading move involves risk, and readers should conduct their own research when making a decision.
",2025-04-04 11:27:01.532443,[],,2025-04-04T11:27:01.532443
84adb395f3f4613d3034af711b686c20,Cointelegraph,Genius Group says it’s been banned from buying more Bitcoin,https://cointelegraph.com/news/ai-firm-genius-group-orced-sell-bitcoin-treasury," The preliminary injunction blocking Bitcoin purchases is connected with a broader dispute surrounding a merger with Fatbrain AI that went sour in October last year. 
Singapore-based artificial intelligence firm Genius Group says it’s temporarily barred from expanding its Bitcoin treasury after a US court order has banned it from selling shares, raising funds and using investor funds to buy more Bitcoin.
A New York District court issued the preliminary injunction (PI) and temporary restraining order (TRO) on March 13 in connection with a broader dispute surrounding its merger with Fatbrain AI, the Genius Group said in an April 3 statement.
Fatbrain AI and Genius Group completed a merger and purchase agreement in March 2024, but by Oct. 30, Genius initiated arbitration procedures to terminate, alleging fraud by Fatbrain AI executives connected to the deal.
Source: Roger James Hamilton
In February, Fatbrain AI executives Michael Moe and Peter Ritz filed for the TRO and permanent injunction, blocking Genius Group from selling its shares, raising funds and buying more Bitcoin pending the arbitration outcome. 
The injunction has forced Genius Group to close divisions, halt marketing activities and sell 10 Bitcoin (BTC) from its stash of 440, worth over $23 million at current prices, to continue funding its operations. The firm hasn’t ruled out more sales in the future.
“Genius is taking all necessary measures to minimize Bitcoin sales but anticipates that it will need to downsize its Bitcoin Treasury in the coming months in the event the PI remains in place,” the firm said.
Fatbrain AI shareholders also filed two lawsuits against Fatbrain AI executives, including Moe and Ritz, and Genius Group, in April 2024, alleging violation of federal securities laws in connection with the merger, ASX law said in an October statement. 
Two shareholder lawsuits against Fatbrain AI alleged conduct during the merger was fraudulent, which defrauded shareholders of $30 million. Source: ASX Law
Genius Group was subsequently voluntarily dismissed from the suits on Feb. 14. 
Genius Group says the US court injunction has also forced it to break Singapore law by halting share compensation to employees as part of its employment agreements.
“We never dreamed that it was possible that a US court could block the company from being able to issue shares, raise funds or buy Bitcoin — all actions that would normally be decided by a public company's shareholders or Board rather than a court,” said Genius Group CEO Roger James Hamilton.
Related: Rumble embraces Trump-era crypto strategy with $17M BTC purchase
He said the firm will “continue to fly the flag for Bitcoin,” even when legally banned from building out its treasury.
Fatbrain AI didn’t immediately respond to Cointelegraph’s request for comment.
Artificial intelligence firm Genius Group first announced in November 2024 that it had taken the first steps to build a Bitcoin treasury by purchasing 110 Bitcoin for $10 million.
The firm had earlier announced its overall goal of committing 90% or more of its current and future reserves to be held in Bitcoin, with an initial target of $120 million, which saw the stock price surge by 66%. 
Genius Group’s share price is down 9.80% in the last trading session to $0.23, with a further 3.74% drop after the bell to $0.22, Google Finance data shows.
Genius Group’s share price went down during the last trading session and after the bell. Source: Google Finance 
The stock hit an all-time high of over $96 in June 2022 but has since lost over 99% of its value. 
Magazine: XRP win leaves Ripple a ‘bad actor’ with no crypto legal precedent set
",2025-04-04 11:27:05.335178,[],,2025-04-04T11:27:05.335178
=======
",1743722062532,[],,2025-04-03T23:14:22.532741
>>>>>>> ec043c9e9722c533bd319f226c0ca43ac0007681
6034707c43205510c9f2cba261199484,Cointelegraph,10-year Treasury yield falls to 4% as DXY softens — Is it time to buy the Bitcoin price dip?,https://cointelegraph.com/news/10-year-treasury-yield-falls-to-4-as-dxy-softens-is-it-time-to-buy-the-bitcoin-price-dip," Will the US-led trade war lead to a golden buying opportunity in Bitcoin price or further downside in the short term? 
On April 3, yields on long-term US government debt fell to their lowest levels in six months as investors reacted to growing concerns over the global trade war and the weakening of the US dollar. The yield on the 10-year Treasury note briefly touched 4.0%, down from 4.4% a week earlier, signaling strong demand from buyers.
US 10-year Treasury yield (left) vs. Bitcoin/USD (right). Source: TradingView / Cointelegraph
At first glance, a higher risk of economic recession may seem negative for Bitcoin (BTC). However, lower returns from fixed-income investments encourage allocations to alternative assets, including cryptocurrencies. Over time, traders are likely to reduce exposure to bonds, particularly if inflation rises. As a result, the path to a Bitcoin all-time high in 2025 remains plausible.
One could argue that the recently announced US import tariffs negatively impact corporate profitability, forcing some companies to deleverage and, in turn, reducing market liquidity. Ultimately, any measure that increases risk aversion tends to have a short-term negative effect on Bitcoin, particularly given its strong correlation with the S&P 500 index.
Axel Merk, chief investment officer and portfolio manager at Merk Investments, said that tariffs create a “supply shock,” meaning the reduced availability of goods and services due to rising prices causes an imbalance relative to demand. This effect is amplified if interest rates are declining, potentially paving the way for inflationary pressure.
Source: X/AxelMerk
Even if one does not view Bitcoin as a hedge against inflation, the appeal of fixed-income investments diminishes significantly in such a scenario. Moreover, if just 5% of the world’s $140 trillion bond market seeks higher returns elsewhere, it could translate into $7 trillion in potential inflows into stocks, commodities, real estate, gold, and Bitcoin.
Gold surged to a $21 trillion market capitalization as it made consecutive all-time highs, and it still has the potential for significant price upside. Higher prices allow previously unprofitable mining operations to resume and it encourages further investment in exploration, extraction, and refining. As production expands, the supply growth will naturally act as a limiting factor on gold’s long-term bull run.
Regardless of trends in US interest rates, the US dollar has weakened against a basket of foreign currencies, as measured by the DXY Index. On April 3, the index dropped to 102, its lowest level in six months. A decline in confidence in the US dollar, even in relative terms, could encourage other nations to explore alternative stores of value, including Bitcoin.
US Dollar Index (DXY). Source: TradingView / Cointelegraph
This transition does not happen overnight, but the trade war could lead to a gradual shift away from the US dollar, particularly among countries that feel pressured by its dominant role. While no one expects a return to the gold standard or Bitcoin to become a major component of national reserves, any movement away from the dollar strengthens Bitcoin’s long-term upside potential and reinforces its position as an alternative asset.
Related: Trump 'Liberation Day' tariffs create chaos in markets, recession concerns
To put things in perspective, Japan, China, Hong Kong, and Singapore collectively hold $2.63 trillion in US Treasuries. If these regions choose to retaliate, bond yields could reverse their trend, increasing the cost of new debt issuance for the US government and further weakening the dollar. In such a scenario, investors would likely avoid adding exposure to stocks, ultimately favoring scarce alternative assets like Bitcoin.
Timing Bitcoin’s market bottom is nearly impossible, but the fact that the $82,000 support level held despite worsening global economic uncertainty is an encouraging sign of its resilience.
This article is for general information purposes and is not intended to be and should not be taken as legal or investment advice. The views, thoughts, and opinions expressed here are the author’s alone and do not necessarily reflect or represent the views and opinions of Cointelegraph.
<<<<<<< HEAD
",2025-04-04 11:27:08.994264,[],,2025-04-04T11:27:08.994264
c43f72eb84509cddc953e82486627eca,Cointelegraph,Here’s what happened in crypto today,https://cointelegraph.com/news/what-happened-in-crypto-today," Need to know what happened in crypto today? Here is the latest news on daily trends and events impacting Bitcoin price, blockchain, DeFi, NFTs, Web3 and crypto regulation. 
Today in crypto, the Chicago Mercantile Exchange (CME) Group announced the launch of Solana futures contracts in March. Meanwhile, global trade concerns continue pressuring investor sentiment, risking a potential Bitcoin correction below the key $75,000 support level. In addition, the US Securities and Exchange Commission has released a statement saying it does not view memecoins as securities.
The Chicago Mercantile Exchange (CME) Group, a globally recognized derivatives exchange, announced it will launch Solana (SOL) futures contracts on March 17, pending a review by United States financial regulators.
According to the Feb. 28 announcement, market participants will have access to micro contracts of 25 SOL or standard contract sizes of 500 SOL, and all contracts will be cash-settled. CME Group already provides futures and options contracts for Bitcoin (BTC) and Ether (ETH) to investors looking to hedge against the highly volatile nature of these digital assets.
The addition of Solana futures contracts gives traditional finance investors additional exposure to the crypto markets and provides the crypto markets with fresh capital injections that should support prices.
CME open interest on derivatives contracts quarter-by-quarter 2024. Source: CME Group
Bitcoin risks more downside if it loses a “key” $75,000 support amid growing concerns over a potential trade war between the United States and China.
Bitcoin’s (BTC) price has fallen more than 6.5% during the past 24 hours to sink below a low of $78,197, which was last seen on Nov. 10, 2024, Cointelegraph Markets Pro data shows.
Analysts attribute the current decline to macroeconomic concerns related to a potential trade war between the US and China caused by US President Donald Trump’s decision to impose import tariffs.
BTC/USD, 1-year chart. Source: Cointelegraph
These macroeconomic concerns were the main reason for Bitcoin losing the $80,000 support, according to Ryan Lee, chief analyst at Bitget Research.
The analyst told Cointelegraph:
Still, some analysts are concerned that Bitcoin’s correction may see the world’s first cryptocurrency revisit $70,000.
Based on its correlation with the global liquidity index, Bitcoin’s right-hand side (RHS), which marks the lowest bid price someone is willing to sell the currency for, may fall below $70,000 around the end of February, after it peaked near $110,000 in January.
The US Securities and Exchange Commission says it does not view memecoins as securities but warned any fraudulent tokens could still be subject to enforcement actions by other regulators.
The agency’s Division of Corporation Finance said in a Feb. 27 statement that, in its view, memecoins “do not involve the offer and sale of securities under the federal securities laws” and “are akin to collectibles.”
Source: David Sacks
“As such, persons who participate in the offer and sale of meme coins do not need to register their transactions with the Commission,” the SEC said.
It added that memecoin buyers and holders wouldn’t be protected by US securities laws but said the fraudulent offer and sale of memecoins “may be subject to enforcement action or prosecution by other federal or state agencies.”
",1740780816989,[],,2025-02-28T22:13:36.989672
=======
",1743722066165,[],,2025-04-03T23:14:26.165318
>>>>>>> ec043c9e9722c533bd319f226c0ca43ac0007681
66595a218897e37157256a0ed45907fe,Cointelegraph,"Cango sells legacy China business, goes all-in on Bitcoin mining: Report",https://cointelegraph.com/news/cango-sells-legacy-china-business-pursues-bitcoin-mining-report," The company reportedly sold its China operations to an entity associated with Bitmain for $352 million. 
Cango, a publicly traded Chinese conglomerate, has agreed to sell its legacy China operations to an entity associated with peer Bitmain in a bid to go all-in on Bitcoin (BTC) mining, according to a report by The Miner Mag. 
Cango agreed to sell its legacy Chinese auto financing business to Ursalpha Digital Limited in a $352 million deal, according to the report.
 Additionally, Bitmain is reportedly transferring 32 exahashes per second (EH/s) to Cango. The deal effectively brings Bitmain’s mining assets to the public market, The Miner Mag said.
Exahashes measure a miner’s contribution to the Bitcoin network’s hashrate, the total computing power securing the network.
The Miner Mag said Ursalpha Digital Limited has the same corporate address and founding director as Antalpha, an entity ultimately controlled by the chairman of Bitcoin miner Bitmain. 
Proxies for Cango’s shares on the NYSE are up 25% this month. Source: Google Finance
Related: Analysts eye Bitcoin miners’ AI, chip sales ahead of Q4 earnings
Bitmain has experienced US scrutiny after the country blacklisted its artificial intelligence affiliate Sopghgo, Bloomberg reported. 
According to Bloomberg, Bitmain has a working relationship with American Bitcoin, a Trump-family-affiliated mining entity created in March as part of a deal with Hut 8, a provider of power and computing infrastructure. 
On March 31, Hut 8 bought a majority ownership interest in American Bitcoin (formerly American Data Centers), whose founders include US President Donald Trump’s sons, Donald Trump Jr. and Eric Trump. 
Hut 8 has transferred its Bitcoin mining equipment to American Bitcoin, which is reportedly mulling an initial public offering (IPO), according to Bloomberg. 
The companies said that American Bitcoin will focus on crypto mining, while Hut 8 targets data center infrastructure for applications such as high-performance computing. 
In 2025, Bitcoin mining stocks have struggled amid declining cryptocurrency prices and pressure on business models caused by the Bitcoin network’s April halving, according to a JPMorgan research note shared with Cointelegraph.
Every four years, the amount of BTC mined per “block” — a bundle of transaction data stored on the chain — is cut in half. April’s halving slashed mining rewards from 6.25 BTC to 3.125 BTC per block.
Magazine: Elon Musk’s plan to run government on blockchain faces uphill battle
<<<<<<< HEAD
",2025-04-04 11:27:12.674434,[],,2025-04-04T11:27:12.674434
=======
",1743722069484,[],,2025-04-03T23:14:29.484442
cd42ed4c86be762452cd63bb6f8d3312,Cointelegraph,Pre-seed crypto startup deals have grown 767% since 2021: Report,https://cointelegraph.com/news/pre-seed-bitcoin-funding-deals-report," Bitcoin-specific startups accounted for only about 6% of the total crypto funding deals in 2024, according to a report from Trammell Venture Partners. 
The number of pre-seed funding rounds for Bitcoin (BTC) startup companies has grown by 767% since 2021, according to a report from venture capital firm Trammell Venture Partners (TVP).
Bitcoin pre-seed transactions increased 50% year-over-year in 2024, with a 27.5% year-over-year increase in the number of startup companies funded.
Christopher Calicott, TVP's managing director, attributed the increased deals to the robust security of the BTC network:
However, the capital raised in Bitcoin pre-seed funding rounds declined by over 22% in 2024, with the median funding round size and the median startup valuation steadily declining from 2021 to 2023. 
Median valuations for pre-seed Bitcoin startups fail to reclaim 2021 levels. Source: Trammell Venture Partners
The value of funding rounds reclaimed some lost ground in 2024 but failed to reach highs established during the previous bull cycle in 2021, primarily due to unclear crypto regulations in the United States under the previous Securities and Exchange Commission (SEC) leadership.
More recently, macroeconomic uncertainty due to fears of a prolonged trade war, relatively high interest rates, and the possibility of a recession in the United States have also eroded the risk appetite for speculative assets like crypto.
Total number of funding deals and unique Bitcoin startup companies has steadily risen since 2021. Source: Trammell Venture Partners
Related: VC Roundup: 8-figure funding deals suggest crypto bull market far from over
In January, Deng Chao, CEO of institutional asset manager HashKey Capital, told Cointelegraph that pro-crypto regulations in the United States would increase VC investment in the sector in 2025.
However, the executive warned that macroeconomic uncertainty and geopolitical turmoil could increase price volatility and disrupt the trend brought on by positive regulatory tailwinds.
On April 2, US President Donald Trump signed a sweeping tariff order establishing a 10% baseline tariff on import goods from all countries and a regime of reciprocal trade tariffs on trading partners that sent financial markets tumbling.
Crypto markets took a nosedive amid trade war fears and macroeconomic uncertainty. Source: CoinMarketCap
Risk-on assets such as stocks and cryptocurrencies typically suffer during trade wars and macroeconomic uncertainty, as investors flee risk assets for safer alternatives such as cash, government securities, and durable commodities.
Venture capital firm Haun Ventures invested $1.5 billion into crypto firms in 2022 but recently announced it seeks to raise only $1 billion in the first half of 2025, citing changed market conditions.
Similarly, analysts at Galaxy Digital also predicted a 50% year-over-year rise in VC-led crypto investments in 2025 but said that VC funding will fail to reach highs established in 2021–2022.
Magazine: Financial nihilism in crypto is over — It’s time to dream big again
