id,source,title,url,content,date,authors,image_url,scraped_at
33633c117003b96774f3ef4c53a24e79,Cointelegraph,"Price predictions 4/23: BTC, ETH, XRP, BNB, SOL, DOGE, ADA, LINK, AVAX, SUI",https://cointelegraph.com/news/price-predictions-4-23-btc-eth-xrp-bnb-sol-doge-ada-link-avax-sui," A spike in spot Bitcoin ETF inflows has analysts calling for a $200,000 Bitcoin price by the end of 2025. Which altcoins could follow? 
Key points:
Bitcoin’s rally is backed by solid institutional buying in the spot BTC ETFs.
A rally above the $95,000 level could be difficult, but analysts’ end-of-year price projections now extend to $200,000.
Select altcoins are showing signs of a price bottom.
Bitcoin (BTC) price rallied close to the $95,000 resistance level on April 23 as the cryptocurrency finds support from rising spot BTC ETF inflows and positive macroeconomic news in the United States. According to Farside Investors, the funds recorded net inflows of $381.3 million on April 21 and $912.7 million on April 22.
Analysts from Standard Chartered and Intellectia AI said that institutional demand for Bitcoin ETFs and BTC’s use as a hedge against macroeconomic risk could propel the price to $200,000 in 2025.
Not everyone is convinced about the current rally. 10x Research head of research Markus Thielen questioned the sustainability of the Bitcoin rally in an April 23 markets report, as the stablecoin minting indicator was “yet to return to high-activity levels.”
Could Bitcoin break above the $95,000 mark, pulling altcoins higher? Let’s analyze the charts of the top 10 cryptocurrencies to find out.
Bitcoin formed a Doji candlestick pattern on April 23, indicating indecision between the bulls and the bears near the $95,000 overhead resistance.
The 20-day exponential moving average ($85,773) has started to turn up, and the relative strength index (RSI) is near the overbought zone, suggesting that the path of least resistance is to the upside. If buyers do not cede much ground to the bears, it enhances the prospects of a rally above $95,000. The BTC/USDT pair may then skyrocket to $100,000 and subsequently to $107,000.
This positive view will be invalidated in the near term if the price turns down sharply from $95,000 and plunges below the moving averages. 
Ether (ETH) turned up sharply on April 22 and rose above the 20-day EMA ($1,676). Buyers will try to retain the advantage by pushing the price above the 50-day SMA ($1,830) on April 23.
If they succeed, the ETH/USDT pair could jump to the breakdown level of $2,111. Sellers will try to stall the recovery at $2,111, but if the bulls prevail, the pair could soar to $2,550. Such a move suggests that the corrective phase may be over.
Conversely, if the price turns down sharply from $2,111, it indicates that the bears are active at higher levels. That could keep the pair range-bound between $2,111 and $1,368 for a while longer.
XRP (XRP) rose above the 50-day SMA ($2.20), but the long wick on the candlestick shows selling at higher levels.
The bears are expected to defend the resistance line with all their might because a break and close above it signals a potential trend change. The XRP/USDT pair could then attempt a rally to $3.
On the contrary, if the price turns down and breaks below the moving averages, it signals that bears remain in command. The pair may then retest the $2 support, which is likely to attract buyers.
BNB (BNB) broke out of the downtrend line on April 21, but higher levels are attracting solid selling by the bears.
The BNB/USDT pair could drop to the moving averages, an important near-term support to watch out for. If the price rebounds off the moving averages with strength, the prospects of a rally to $644 and thereafter to $680 increase. 
Alternatively, a break and close below the moving averages indicates that the breakout above the downtrend line may have been a bull trap. The pair then risks falling to $566.
Solana (SOL) rebounded off the 20-day EMA ($133) on April 22 and is attempting to climb above the overhead resistance at $153 on April 23.
The 20-day EMA is sloping up, and the RSI is in the positive territory, indicating an advantage to buyers. A close above $153 clears the path for a rally to $180. Such a move brings the large $110 to $260 range into play.
Time is running out for the bears. If they want to make a comeback, they will have to swiftly pull the price below the moving averages. If they do that, the SOL/USDT pair could plunge to the $120 to $110 support zone.
Dogecoin (DOGE) broke above the moving averages on April 22, indicating that the bulls are on a comeback.
The price could rally to the overhead resistance at $0.21, where the bears are expected to step in. If the price turns down from $0.21 and breaks below the moving averages, it signals a range-bound action in the near term. The DOGE/USDT pair could swing between $0.21 and $0.14 for some time.
Contrarily, a break and close above $0.21 completes a double-bottom pattern. The pair could then rally toward its target objective of $0.28.
Buyers pushed Cardano (ADA) above the 20-day EMA ($0.64) on April 22 and are trying to sustain the price above the 50-day SMA ($0.68) on April 23.
The 20-day EMA is flattish, but the RSI has jumped into positive territory, indicating that the momentum has turned positive. A close above the 50-day SMA opens the gates for a rally to $0.83.
Buyers are expected to defend the zone between the 20-day EMA and $0.58 on the downside. Sellers will be back in the driver’s seat if they sink the ADA/USDT pair below $0.58. The pair may then slump to $0.50.
Related: Why is Bitcoin price up today?
Chainlink (LINK) turned up from the 20-day EMA ($13.16) and rose above the 50-day SMA ($13.62) on April 22.
The LINK/USDT pair could rise to $16, where the bears may mount a strong defense. If buyers do not allow the price to dip back below the 20-day EMA, it improves the prospects of a rally to the resistance line of the descending channel pattern. A trend change will be signaled on a break above the channel.
The 20-day EMA is the crucial support to watch out for on the downside. A dive below the 20-day EMA opens the doors for a fall to $11.89 and later to the support line.
Avalanche (AVAX) broke out of the downtrend line on April 22, indicating that the bears are losing their grip.
The bears will try to halt the recovery at $23.50 because if they fail in their endeavor, the AVAX/USDT pair will complete a double-bottom pattern. This bullish setup has a target objective of $31.73.
If the price turns down from $23.50, the bulls will try to buy the dips to the 20-day EMA ($19.72). A bounce off the 20-day EMA increases the likelihood of a break above $23.50. Contrarily, a break below the moving averages signals a range formation between $15.27 and $23.50.
Sui (SUI) soared above the moving averages on April 22 and the overhead resistance at $2.86 on April 23.
The long wick on the candlestick shows selling above $2.86, but if the bulls do not give up much ground, the possibility of a break above the overhead resistance increases. That could propel the SUI/USDT pair to $3.25 and then to $3.50.
The 20-day EMA ($2.29) is expected to act as strong support on any pullback. A break and close below the 20-day EMA suggests the bullish momentum has weakened. That could result in a range formation in the near term.
This article does not contain investment advice or recommendations. Every investment and trading move involves risk, and readers should conduct their own research when making a decision.

",1745443584115,[],,2025-04-23T21:26:24.115360
934555077f8cafbceb4e5f36bd81f71c,Cointelegraph,"Bretton Woods institutions must reorient, US Treasury secretary says",https://cointelegraph.com/news/bessent-calls-bretton-woods-institutions-reorient," Scott Bessent said institutions such as the IMF and World Bank must correct trade imbalances and protect the value of fiat currencies against exchange rate risks. 
United States Treasury Secretary Scott Bessent recently called for “Bretton Woods institutions,” such as the International Monetary Fund (IMF), to reorient themselves, a signal that the global monetary order could be shifting.
Speaking at the Institute of International Finance (IIF) on April 23, Bessent called on the IMF and the World Bank to correct trade imbalances and protect the value of fiat currencies against exchange rate risk.
""The Bretton Woods institutions must step back from their sprawling and unfocused agendas,"" Bessent said. He added:
Bessent's call for the IMF to correct trade imbalances between countries, specifically the US and China, coincides with a decline in the US dollar to three-year lows, $36 trillion in US government debt, and stiff economic competition from China.
Investor and hedge fund manager Ray Dalio argues that the world is experiencing a global macroeconomic shift that will upend the post-WWII financial order and eventually replace the US dollar as the global reserve currency, potentially with a digital form of money.
Related: Trump tariffs reignite idea that Bitcoin could outlast US dollar
The Bretton Woods Agreement was signed in 1944 and pegged the currencies of 44 countries to the value of the US dollar, which, at that point, was pegged to the value of gold at $35 per ounce.
Eliminating complex foreign exchange risks between freely floating currencies to make global trade more efficient was the primary goal of the agreement.
In August 1971, US President Richard Nixon announced the end of the dollar's convertibility to gold — formally ending the Bretton Woods agreement in a move that was supposed to be temporary.
“Your dollar will be worth just as much tomorrow as it does today,” Nixon incorrectly told Americans during his now-infamous address.
The IMF and the World Bank, which were spawned from the Bretton Woods agreement, continue operating in an attempt to curb the effects of free-floating fiat currencies on the foreign exchange market.
Speaking at the White House Digital Asset Summit on March 7, Bessent said stablecoins could drive international demand for US dollars and US government debt instruments.
Bessent added that the Trump administration will use stablecoins to protect the US dollar and its status as the global reserve currency.
Bitcoin maximalist Max Keiser argued against this plan, predicting that gold-backed stablecoins would outcompete dollar-pegged tokens due to the desire for low-volatility, inflation-resistant money.
In March this year, BlackRock CEO Larry Fink wrote that the $36 trillion US national debt could drive investors to Bitcoin (BTC) as market participants start to see BTC as a better store of value than the US dollar.
Bitwise executive Jeff Park voiced a similar prediction in February, focused on the effects of US President Donald Trump's trade tariffs.
The analyst wrote that the tumult from the ongoing trade war would cause worldwide inflation, which would cause individuals to seek alternative stores of value like Bitcoin, driving its price much higher in the long term.
Magazine: Bitcoin payments are being undermined by centralized stablecoins
",1745443587233,[],,2025-04-23T21:26:27.233081
=======
b2e86ead374aa36828498796cee2b07f,Cointelegraph,Bitcoin rebounds as bulls eye $100K and bears scramble to cover short positions,https://cointelegraph.com/news/bitcoin-rallies-as-bulls-eye-100-k-and-bears-rush-to-cover-shorts," Bitcoin bears are at risk of deep losses as soaring inflows to the spot BTC ETFs highlight the return of institutional investor demand. 
Key takeaways: 
Bearish Bitcoin traders were caught off guard by BTC’s rally above $90,000.
Spot volumes are driving the Bitcoin price rally.
Derivatives positions with a bearish bias remain at risk of liquidation.
Bitcoin (BTC) held above the $93,000 mark on April 24, suggesting a potential conclusion to the 52-day bear market that bottomed at $74,400. Although Bitcoin is beginning to show signs of decoupling from the stock market, professional traders have not altered their strategies, as indicated by BTC futures and margin market data.
A higher long-to-short ratio reflects a preference for long (buy) positions, while a lower ratio indicates a tilt toward short (sell) contracts. Currently, the top traders’ long-to-short ratio on Binance stands at 1.5x, a notable decrease from the 2x level observed ten days earlier. At OKX, the ratio peaked near 1.1x on April 17 but has since lost momentum and now sits at 0.9x.
Bitcoin’s 10% rally between April 20 and April 24 coincided with a more conciliatory stance from US President Donald Trump regarding import tariffs and his criticism of Federal Reserve Chair Jerome Powell, who has faced scrutiny for maintaining high interest rates. On April 24, Trump stated he had “no intention” of firing Powell, marking a notable shift from his previous rhetoric.
Amid economic uncertainty, Deutsche Bank strategists have reduced their year-end S&P 500 target by 12% to 6,150. Meanwhile, the US dollar has weakened against other major currencies, pushing the DXY index below 99 for the first time in three years. Despite a modest 6% gain over the past 30 days, Bitcoin’s performance has secured it a place among the world’s top eight tradable assets, with a market capitalization of $1.84 trillion.
The sharp move above $90,000 caught Bitcoin bears off guard, resulting in over $390 million in leveraged short (sell) futures liquidations between April 21 and April 22. More significantly, aggregate open interest in BTC futures remains just 5% below its all-time high, indicating that bearish traders have not fully exited their positions.
If Bitcoin’s price maintains its upward momentum and breaks above $95,000, an additional $700 million in short (sell) futures positions could be liquidated, according to CoinGlass data. This potential short squeeze may prove especially challenging for bears, given the robust inflows into spot Bitcoin exchange-traded funds (ETFs), which totaled over $2.2 billion between April 21 and April 23.
A newly announced joint venture involving SoftBank, Cantor Fitzgerald, and Tether aims to accumulate Bitcoin through convertible bonds and equity financing, which could further strengthen the bullish case. Named “Twenty One Capital,” the Bitcoin treasury company is led by Strike founder Jack Mallers and plans to launch with 42,000 BTC.
Related: Sovereign wealth funds piling into BTC as retail exits — Coinbase exec
The muted response from top traders in BTC margin and futures markets suggests that the recent buying pressure has originated mainly from spot markets, which is generally considered a positive indicator for a sustainable bull run.
The longer Bitcoin consolidates above $90,000, the greater the pressure on bears to cover their shorts, as this level reinforces the narrative that Bitcoin is decoupling from the stock market. This could provide the confidence needed to challenge the $100,000 psychological threshold.
This article is for general information purposes and is not intended to be and should not be taken as legal or investment advice. The views, thoughts, and opinions expressed here are the author’s alone and do not necessarily reflect or represent the views and opinions of Cointelegraph.
",1745519906359,[],,2025-04-24T18:38:26.359484
a1d34ef0840cbb053f3c7d3771b0bcb1,Cointelegraph,Bitcoin supply on exchanges is falling ‘due to public company purchases’ — Fidelity,https://cointelegraph.com/news/bitcoin-supply-exchanges-falling-public-company-purchases-fidelity," BTC reserves on cryptocurrency exchanges have fallen to the lowest level since November 2018. 
Bitcoin reserves on cryptocurrency exchanges have dropped to their lowest level in more than six years, as publicly traded companies ramp up their accumulation of the digital asset following the US presidential election, according to Fidelity Digital Assets. 
“We have seen Bitcoin supply on exchanges dropping due to public company purchases — something we anticipate accelerating in the near future,” Fidelity reported on the X social media platform.
Fidelity said the supply of Bitcoin (BTC) on exchanges had fallen to roughly 2.6 million BTC, the lowest since November 2018. More than 425,000 BTC have moved off exchanges since November, a trend often viewed as a signal of long-term investment rather than short-term trading.
Over the same period, publicly-traded companies acquired nearly 350,000 BTC, Fidelity said.
Fidelity Digital Assets is a subsidiary of Fidelity Investments, the $5.8 trillion asset manager headquartered in Boston, Massachusetts. The Fidelity Digital subsidiary was established in 2018, long before cryptocurrency was considered an institutional asset class. 
Fidelity is the issuer of the Fidelity Wise Origin Bitcoin Fund, one of the first 11 spot Bitcoin exchange-traded funds approved in the United States.
Related: Bitcoin exchange buying is back as 'Spoofy the Whale' lifts $90K asks
While Fidelity noted significant corporate Bitcoin purchases, most of the accumulation has been driven by Strategy, the business intelligence firm-turned-Bitcoin bank co-founded by Michael Saylor.
Since November, Strategy has acquired 285,980 BTC, accounting for 81% of the approximately 350,000 BTC purchased by publicly traded companies.
Strategy’s latest purchase of 6,556 BTC was disclosed on April 21. 
Outside the United States, publicly traded companies in Asia have adopted a similar Bitcoin treasury strategy, with Japan’s Metaplanet and Hong Kong’s HK Asia Holdings increasing their Bitcoin allocations. 
Metaplanet currently holds 5,000 BTC, with CEO Simon Gerovich saying his goal is to double that amount this year.
Meanwhile, HK Asia Holdings announced plans to raise roughly $8.35 million to potentially increase its Bitcoin reserves. 
Magazine: Altcoin season to hit in Q2? Mantra’s plan to win trust: Hodler’s Digest, April 13 – 19
",1745519909821,[],,2025-04-24T18:38:29.821637
b208085932c4715f39885a1547edc622,Cointelegraph,Bitcoin 'short squeeze' or $87K dip next? BTC price predictions vary,https://cointelegraph.com/news/bitcoin-short-squeeze-87k-dip-btc-price-predictions-vary," Bitcoin could liquidate a large block of leveraged shorts with a trip above its yearly open, but BTC price dip expectations are building as traders eye $87,000. 
Bitcoin is setting up a showdown with leveraged shorts immediately above its yearly open price.
That key level near $93,500 is the main target for traders hoping that BTC/USD will cement its latest breakout.
The next support retest could involve $87,000, analysis suggests.
Bitcoin (BTC) consolidated below a key resistance target on April 24 as a BTC price forecast brought sub-$90,000 levels into play.
Data from Cointelegraph Markets Pro and TradingView showed BTC/USD retesting $92,000 as support overnight.
The pair broadly maintained six-week highs while global markets remained at a loss over the trajectory of the ongoing US trade war.
“The market is now up over +1% on the day on no news at all,” trading resource The Kobeissi Letter summarized alongside a chart of the S&P 500 in part of its latest analysis on X.
Bitcoin continued to brush off news events, leaving volatility to equities, while gold attempted to stabilize after slipping from record highs earlier in the week.
“Fairly normal to have a slight correction here on Bitcoin as it's just had a massive breakout,” crypto trader, analyst and entrepreneur Michaël van de Poppe told X followers on the day.
Others increasingly entertained the idea of a deeper correction following brisk gains for BTC/USD, potentially taking the market back below the $90,000 mark.
“A dip to 88k would be lovely,” popular trader Inmortal argued. 
A dip to 88k would be lovely.If the market gives it, I will probably play one of these two setups, or both.$BTC pic.twitter.com/ysqiheds7X
Trader and analyst Rekt Capital had a similar conception of the potential support retest move.
BTC price action, he observed, was closely copying behavior from the middle of its previous bull market in 2021.
“Part of Bitcoin continuing to repeat mid-2021 price tendencies relative to the Bull Market EMAs would be a dip into the $87000 (green EMA) level for a post-breakout retest, if at all needed,” he commented on a weekly chart showing two exponential moving averages (EMAs).
The main target for bulls thus remained the yearly open level just above $93,000, one which remained intact as resistance at the time of writing.
Related: Bitcoin exchange outflows mimic 2023 as whales buy retail 'panic'
This coincided with a block of potential liquidation levels on exchange order books, providing fertile conditions for a “short squeeze” should price attack them.
$BTC Liquidation heatmap shows that liquidity of leveraged positions is building up on both sides. Leveraged longs mainly around $91,400.Leveraged shorts around $93,500-$94,500. pic.twitter.com/d2jCyO2FdC
The latest data from monitoring resource CoinGlass showed the largest concentration of liquidation leverage centered around $93,600.
Earlier, Cointelegraph reported on a large trading entity dubbed “Spoofy the Whale” removing a wall of asks at $90,000.
This article does not contain investment advice or recommendations. Every investment and trading move involves risk, and readers should conduct their own research when making a decision.

",1745519913661,[],,2025-04-24T18:38:33.661779
