id,source,title,url,content,date,authors,image_url,scraped_at
a925a20c4e10af327d439c2b266309a5,Cointelegraph,"Trump’s Strategic Bitcoin Reserve and Digital Asset Stockpile, explained",https://cointelegraph.com/explained/trumps-strategic-bitcoin-reserve-and-digital-asset-stockpile-explained," Donald Trump’s stance on cryptocurrency has shifted significantly over time. From 2019 to 2021, Trump expressed skepticism toward Bitcoin (BTC), calling it volatile and a threat to the US dollar, but by 2024, he reversed his stance, pledging support for crypto, proposing a US Strategic Bitcoin Reserve and criticizing the Biden administration’s anti-crypto policies.Early skepticism (2019–2021)July 2019: While in office, Trump tweeted that he was “not a fan” of Bitcoin, calling it “not money” and criticizing its volatility. He also opposed Facebook’s Libra (Diem) project, arguing that tech companies shouldn’t issue currency without a banking charter.June 2021: After leaving office, Trump labeled Bitcoin a “scam” and a threat to the US dollar, advocating for strict regulation to prevent it from undermining the US financial system.Crypto policy during his presidency (2017–2020)Trump’s administration generally took a cautious stance on crypto:Treasury Secretary Steven Mnuchin warned of Bitcoin’s risks and dismissed its long-term viability.The Treasury Department proposed stricter tracking rules for digital wallets, which faced industry backlash.Some Trump appointees supported crypto-friendly banking policies, but these were exceptions to an overall skeptical approach.Pro-crypto pivot in 2024Ahead of the 2024 election, Trump reversed course, pledging to end the Biden administration’s “anti-crypto” stance. He:Declared himself “very positive and open-minded” on Bitcoin.Promised to fire top crypto-skeptic regulators if reelected.Proposed a US Strategic Bitcoin Reserve, vowing to hold on to seized Bitcoin instead of auctioning it off.This dramatic shift set the foundation for Trump’s strategic Bitcoin reserve.  
Donald Trump’s stance on cryptocurrency has shifted significantly over time. From 2019 to 2021, Trump expressed skepticism toward Bitcoin (BTC), calling it volatile and a threat to the US dollar, but by 2024, he reversed his stance, pledging support for crypto, proposing a US Strategic Bitcoin Reserve and criticizing the Biden administration’s anti-crypto policies.
Trump’s administration generally took a cautious stance on crypto:
Ahead of the 2024 election, Trump reversed course, pledging to end the Biden administration’s “anti-crypto” stance. He:
This dramatic shift set the foundation for Trump’s strategic Bitcoin reserve. 

 One of Trump’s headline proposals is creating a Strategic Bitcoin Reserve for the US, treating Bitcoin as a national reserve asset akin to digital gold. The plan centers on stockpiling Bitcoin seized in criminal cases rather than purchasing it with taxpayer funds.Key componentsBitcoin as a reserve asset: The US government would officially recognize Bitcoin as a strategic holding, similar to gold in Fort Knox, leveraging its fixed supply and decentralized nature.Seized crypto, not taxpayer purchases: Instead of selling confiscated Bitcoin at auction (as has been past practice), the government would retain it in a central reserve account. Trump’s executive order explicitly states that any Bitcoin deposited “shall not be sold.”No immediate buying spree: The plan does not include direct federal purchases of BTC but allows for “budget-neutral” methods to expand reserves, such as using proceeds from other seized assets.Does the US already have a Bitcoin stockpile? Yes, indirectly. Over the past decade, agencies have seized large amounts of BTC but historically auctioned it off rather than holding it. Trump’s policy would change that, aiming to preserve Bitcoin as a national asset.Supporters believe this could strengthen US finances and ensure the nation isn’t left behind in a Bitcoin-driven global economy. However, critics warn of Bitcoin’s volatility and the risks of integrating a decentralized asset into government reserves. 
One of Trump’s headline proposals is creating a Strategic Bitcoin Reserve for the US, treating Bitcoin as a national reserve asset akin to digital gold. The plan centers on stockpiling Bitcoin seized in criminal cases rather than purchasing it with taxpayer funds.

Does the US already have a Bitcoin stockpile? Yes, indirectly. Over the past decade, agencies have seized large amounts of BTC but historically auctioned it off rather than holding it. Trump’s policy would change that, aiming to preserve Bitcoin as a national asset.
Supporters believe this could strengthen US finances and ensure the nation isn’t left behind in a Bitcoin-driven global economy. However, critics warn of Bitcoin’s volatility and the risks of integrating a decentralized asset into government reserves.
 No, a digital asset stockpile is a separate reserve that would hold other forfeited cryptocurrencies.The Strategic Bitcoin Reserve focuses solely on holding Bitcoin as a reserve asset, while the Digital Asset Stockpile includes other forfeited digital assets such as Ether (ETH) or USDC (USDC), though these assets might be strategically managed or sold over time. Bitcoin, however, would be held indefinitely in the reserve.Notably, Trump’s executive order does not explicitly mention what specific crypto assets will be included in the US Digital Asset Stockpile. Here are the commonalities and differences between the Strategic Bitcoin Reserve and the US Digital Asset Stockpile: 
No, a digital asset stockpile is a separate reserve that would hold other forfeited cryptocurrencies.
The Strategic Bitcoin Reserve focuses solely on holding Bitcoin as a reserve asset, while the Digital Asset Stockpile includes other forfeited digital assets such as Ether (ETH) or USDC (USDC), though these assets might be strategically managed or sold over time. Bitcoin, however, would be held indefinitely in the reserve.
Notably, Trump’s executive order does not explicitly mention what specific crypto assets will be included in the US Digital Asset Stockpile. 
Here are the commonalities and differences between the Strategic Bitcoin Reserve and the US Digital Asset Stockpile:

 Trump’s Bitcoin reserve plan builds on a history of US government interactions with cryptocurrency, primarily through law enforcement and asset seizures.Seizures and auctions (Silk Road era)The government’s relationship with Bitcoin began in 2013–2014 with the Silk Road takedown, where federal agents seized 144,000 BTC — one of the largest Bitcoin hauls ever. Rather than holding the coins, the US Marshals Service auctioned them off, setting a precedent for liquidating seized crypto. Did you know? In 2014, venture capitalist Tim Draper bought 30,000 BTC for $18 million, a fraction of its later value.Accumulating and selling crypto holdingsSince then, US agencies have continued seizing and auctioning Bitcoin from various cases, selling nearly 200,000 BTC between 2014 and early 2023, netting around $366 million. However, with Bitcoin’s price surge, those sold coins would now be worth over $18 billion — raising questions about whether the government should have held onto them. Crypto advocates argue this history justifies a hodl policy rather than continued liquidation.Past administration policiesObama administration: Focused on regulating exchanges and curbing illicit use.Trump’s first term: Emphasized enforcement, sanctioning crypto accounts linked to adversaries and targeting tax evaders.Biden administration: Prioritized investor protection and regulatory enforcement, pursuing lawsuits against major exchanges in 2023 and continuing liquidation of seized Bitcoin rather than holding it.The idea of a national Bitcoin reserve was largely absent from previous administrations — until Trump’s 2024 proposal.Global contextOther governments, including China and Germany, have seized Bitcoin, but most — like the US — chose to auction it rather than stockpile it. No major economy has yet integrated Bitcoin into its sovereign reserves. The closest example is El Salvador, which made Bitcoin legal tender in 2021 and began accumulating it. If fully implemented, Trump’s Bitcoin reserve strategy would make the US the first major nation to officially hold Bitcoin as a strategic asset, a significant shift in global crypto policy.Did you know? ​In 2024, Bhutan’s sovereign investment arm quietly amassed $750 million in Bitcoin holdings through hydroelectric-powered mining, amounting to 28% of the country’s gross domestic product. 
Trump’s Bitcoin reserve plan builds on a history of US government interactions with cryptocurrency, primarily through law enforcement and asset seizures.
The government’s relationship with Bitcoin began in 2013–2014 with the Silk Road takedown, where federal agents seized 144,000 BTC — one of the largest Bitcoin hauls ever. Rather than holding the coins, the US Marshals Service auctioned them off, setting a precedent for liquidating seized crypto. 
Did you know? In 2014, venture capitalist Tim Draper bought 30,000 BTC for $18 million, a fraction of its later value.
Since then, US agencies have continued seizing and auctioning Bitcoin from various cases, selling nearly 200,000 BTC between 2014 and early 2023, netting around $366 million. 
However, with Bitcoin’s price surge, those sold coins would now be worth over $18 billion — raising questions about whether the government should have held onto them. Crypto advocates argue this history justifies a hodl policy rather than continued liquidation.
The idea of a national Bitcoin reserve was largely absent from previous administrations — until Trump’s 2024 proposal.
Other governments, including China and Germany, have seized Bitcoin, but most — like the US — chose to auction it rather than stockpile it. No major economy has yet integrated Bitcoin into its sovereign reserves. 
The closest example is El Salvador, which made Bitcoin legal tender in 2021 and began accumulating it. If fully implemented, Trump’s Bitcoin reserve strategy would make the US the first major nation to officially hold Bitcoin as a strategic asset, a significant shift in global crypto policy.
Did you know? ​In 2024, Bhutan’s sovereign investment arm quietly amassed $750 million in Bitcoin holdings through hydroelectric-powered mining, amounting to 28% of the country’s gross domestic product.
 If the US establishes a Strategic Bitcoin Reserve, the implications could be significant for markets, regulation and financial strategy.Market dynamicsA no-sell policy would remove key selling pressure, as seized Bitcoin would no longer be auctioned off, effectively reducing circulating supply. Some analysts see this as bullish for Bitcoin’s price. Anticipation of Trump’s pro-crypto stance already fueled market optimism in late 2024. However, political shifts could bring uncertainty — future administrations might reverse the policy and sell, making government-held Bitcoin a new market-moving factor.Legitimacy and mainstreamingIf the US holds Bitcoin as a strategic asset, it would mark the strongest government endorsement of crypto to date. This could encourage institutional investors and pressure other nations to consider similar policies. If multiple governments start stockpiling Bitcoin, it could integrate crypto more deeply into global finance, potentially affecting reserve diversification and even international sanctions.Regulatory shiftA national Bitcoin reserve aligns with a broader pro-crypto shift in US regulation. Trump has already signaled a friendlier stance, calling for clearer rules and protecting crypto firms’ banking access. This could reverse past regulatory hostility, making the US a more attractive hub for blockchain businesses.With the government holding Bitcoin, it may also incentivize policies that promote crypto growth, though balancing innovation and consumer protection remains a challenge.Did you know? ​In 2025, President Trump appointed David Sacks as the White House AI and crypto czar to establish a legal framework for the cryptocurrency industry.Financial strategy and the dollarTrump insists Bitcoin won’t replace the US dollar, but holding it as a reserve asset could complement rather than compete with the dollar — similar to gold. If Bitcoin appreciates, it could strengthen US financial standing, but if it gains too much influence in global reserves, it might challenge fiat dominance over time.While speculative for now, a national Bitcoin reserve could reshape the role of digital assets in global finance. 
If the US establishes a Strategic Bitcoin Reserve, the implications could be significant for markets, regulation and financial strategy.
A no-sell policy would remove key selling pressure, as seized Bitcoin would no longer be auctioned off, effectively reducing circulating supply. Some analysts see this as bullish for Bitcoin’s price. 
Anticipation of Trump’s pro-crypto stance already fueled market optimism in late 2024. However, political shifts could bring uncertainty — future administrations might reverse the policy and sell, making government-held Bitcoin a new market-moving factor.
If the US holds Bitcoin as a strategic asset, it would mark the strongest government endorsement of crypto to date. This could encourage institutional investors and pressure other nations to consider similar policies. 
If multiple governments start stockpiling Bitcoin, it could integrate crypto more deeply into global finance, potentially affecting reserve diversification and even international sanctions.
A national Bitcoin reserve aligns with a broader pro-crypto shift in US regulation. Trump has already signaled a friendlier stance, calling for clearer rules and protecting crypto firms’ banking access. This could reverse past regulatory hostility, making the US a more attractive hub for blockchain businesses.
With the government holding Bitcoin, it may also incentivize policies that promote crypto growth, though balancing innovation and consumer protection remains a challenge.
Did you know? ​In 2025, President Trump appointed David Sacks as the White House AI and crypto czar to establish a legal framework for the cryptocurrency industry.
Trump insists Bitcoin won’t replace the US dollar, but holding it as a reserve asset could complement rather than compete with the dollar — similar to gold. 
If Bitcoin appreciates, it could strengthen US financial standing, but if it gains too much influence in global reserves, it might challenge fiat dominance over time.
While speculative for now, a national Bitcoin reserve could reshape the role of digital assets in global finance.

 Trump’s Bitcoin reserve plan has sparked both enthusiasm and criticism. Key concerns include volatility, political optics and legal hurdles.Volatility and riskBitcoin’s price swings make it a risky reserve asset. Unlike gold or US Treasurys, Bitcoin can drop 10% in a day, raising concerns about exposing taxpayer-linked reserves to major losses. Critics compare it to gambling with public funds, while supporters argue that not holding Bitcoin poses a bigger risk if it continues to appreciate.Political “flip-flop”Trump once called Bitcoin a threat to the dollar, but now champions it. Opponents see this as opportunism, driven by campaign donations from crypto investors rather than a genuine policy shift. Supporters argue it reflects Republican modernization, appealing to a younger, crypto-friendly voter base.Favoring Bitcoin over other cryptocurrenciesBy stockpiling Bitcoin, the government may be seen as picking winners and losers in the crypto market. This could marginalize smaller tokens and raise concerns over market intervention. Some fear Trump’s crypto agenda could slow down broader regulation by making the issue partisan.Legal and logistical hurdlesTransferring seized Bitcoin into a government reserve isn’t simple. Current laws mandate auctions, meaning Congress may need to intervene. Additionally, securing billions in crypto requires top-tier cybersecurity, as hacks or key losses could be disastrous. Lawmakers are also pushing for transparency on how much Bitcoin the government actually holds.Economic strategy uncertaintyHow does Bitcoin fit into US monetary policy? The Federal Reserve does not currently treat crypto as part of its system. If the Treasury holds Bitcoin, would it influence monetary decisions or simply remain an investment? Trump’s policy also bans a US central bank digital currency to prevent competition with private crypto, raising questions about the coherence of US financial strategy.The Bitcoin reserve experiment could reshape US crypto policy — or create new complexities that challenge its long-term viability. 
Trump’s Bitcoin reserve plan has sparked both enthusiasm and criticism. Key concerns include volatility, political optics and legal hurdles.
Bitcoin’s price swings make it a risky reserve asset. Unlike gold or US Treasurys, Bitcoin can drop 10% in a day, raising concerns about exposing taxpayer-linked reserves to major losses. Critics compare it to gambling with public funds, while supporters argue that not holding Bitcoin poses a bigger risk if it continues to appreciate.
Trump once called Bitcoin a threat to the dollar, but now champions it. Opponents see this as opportunism, driven by campaign donations from crypto investors rather than a genuine policy shift. Supporters argue it reflects Republican modernization, appealing to a younger, crypto-friendly voter base.
By stockpiling Bitcoin, the government may be seen as picking winners and losers in the crypto market. This could marginalize smaller tokens and raise concerns over market intervention. Some fear Trump’s crypto agenda could slow down broader regulation by making the issue partisan.
Transferring seized Bitcoin into a government reserve isn’t simple. Current laws mandate auctions, meaning Congress may need to intervene. Additionally, securing billions in crypto requires top-tier cybersecurity, as hacks or key losses could be disastrous. Lawmakers are also pushing for transparency on how much Bitcoin the government actually holds.
How does Bitcoin fit into US monetary policy? 
The Federal Reserve does not currently treat crypto as part of its system. If the Treasury holds Bitcoin, would it influence monetary decisions or simply remain an investment? 
Trump’s policy also bans a US central bank digital currency to prevent competition with private crypto, raising questions about the coherence of US financial strategy.
The Bitcoin reserve experiment could reshape US crypto policy — or create new complexities that challenge its long-term viability.
",1741691698342,[],,2025-03-11T11:14:58.342567
0a8051da6de03bb4790d08edd4cd000d,Cointelegraph,Mt. Gox makes second $900M+ move in a week as Bitcoin taps $76K,https://cointelegraph.com/news/mt-gox-makes-second-billion-dollar-transfer-as-bitcoin-tanks-to-76000," Mt. Gox moved a batch of Bitcoin worth over $930 million on March 11 as the bankrupt crypto exchange vies to fully repay customers by Oct. 31. 
Defunct crypto exchange Mt. Gox moved almost a billion worth of Bitcoin, the second large BTC transfer in a week, as Bitcoin’s price fell to a four-month low on March 11.
Of the 11,833 Bitcoin (BTC) moved, 11,501 ($905.1 million) were sent into a new wallet, while the remaining 332 Bitcoin ($26.1 million) were transferred to a warm wallet, according to blockchain analytics firm Lookonchain, citing Arkham Intelligence data. 
The transfer cost Mt. Gox just $2.13.
Transaction details of Mt. Gox’s $931 million transfer. Source: Arkham Intelligence
It comes less than a week after Mt. Gox moved 12,000 Bitcoin worth a little over $1 billion on March 6. Arkham noted that $15 million of those funds were sent to BitGo — one of the custodians facilitating Mt. Gox’s creditor repayments.
Blockchain analytics firm Spot On Chain said the 332 Bitcoin that recently went into the warm wallet may also be moved to assist with the repayments.
The movement coincided with a 2.4% price fall for Bitcoin to $76,784 over 30 minutes, CoinGecko data shows, retreating to November prices when the market was rallying on the back of US President Donald Trump’s election win.
While Bitcoin recovered from the slump to $79,275 soon after, Maelstrom chief investment officer Arthur Hayes advised investors to “be fucking patient” in a March 11 X post in which he predicted Bitcoin would bottom around the $70,000 mark.
Source: Arthur Hayes
Related: Bitcoin may benefit from US stablecoin dominance push
Mt. Gox’s main wallets now only hold 24,411 Bitcoin — worth $1.94 billion — after the exchang started offloading around $9.2 billion worth of Bitcoin in June 2024, Spot On Chain data shows.
Mt. Gox’s change in Bitcoin holdings since 2015. Source: Spot On Chain
Last October, the defunct crypto exchange extended its deadline to fully repay its creditors, saying it would do so by Oct. 31, 2025.Mt. Gox was the largest Bitcoin exchange between 2010 and 2014 — handling around 70-80% of Bitcoin trades before it collapsed from a hack that saw up to 850,000 Bitcoin stolen from the Tokyo-based platform.
Magazine: Train AI agents to make better predictions… for token rewards
",1741691701602,[],,2025-03-11T11:15:01.602986
5d9f4f9861ac6c7c73ce0f20faf7e3d8,Cointelegraph,Pomp: Trump deliberately crashed markets to get interest rates down,https://cointelegraph.com/news/trump-intentionally-crashing-markets-force-fed-lower-interest-rates," Anthony Pompliano speculates US President Donald Trump may be taking matters into his own hands in an attempt to lower interest rates. 
The Trump administration may be intentionally creating uncertainty in the stock markets to corner Federal Reserve chair Jerome Powell into lowering interest rates, according to a market commentator. 
Doing so increases the likelihood that the US won’t need to refinance around $7 trillion in debt it owes over the next few months, Bitcoin commentator Anthony Pompliano said in a March 10 X post.
US President Donald Trump and Secretary of the Treasury Scott Bessent are “taking matters into their own hands; they’re crashing asset prices in an attempt to force Jerome Powell to cut interest rates,” said Pompliano, who serves as the founder and CEO of Professional Capital Management and host of The Pomp Podcast. 
The President and his team are intentionally crashing the market.Is this a master plan or are we watching uncontrolled destruction?! pic.twitter.com/Tbc0M9Rjxu
In late January, Powell announced the Fed was not lowering interest rates from the current target range of 4.25% to 4.5% despite calls from Trump to do so.
Pompliano said the recent market panic has been driven in part by Trump’s tariffs — and has been used to create a more favorable bond market while lowering the 10-year Treasury yield.
He noted that the 10-year Treasury yield is already down from nearly 4.8% in January to 4.21% now — a sign that Trump’s purported strategy is “heading in the right direction.”
Source: Thomas Kralow
Whether Pompliano’s theory is correct or not, the stock market has been tanking of late, and crypto has been hit even harder.
Broad market index funds such as State Street’s Standard & Poor’s 500 index fund (SPY) fell 2.66% on March 10 alone, while the Nasdaq-100% fell 3.8%, Google Finance data shows.
Both indexes are down 7.32% and 10.7% over the last month, while Bitcoin (BTC) is down 27.4% from its $108,786 all-time high, and over $1.2 trillion has been wiped from the cryptocurrency market cap since Dec. 17. 
If the stock market continues to tank, it will come down to a “who blinks first” contest between Trump and Powell, Pompliano said.
While Trump hasn’t confirmed such a strategy, Pompliano pointed to a Fox News interview on March 9 where Trump said: “Nobody ever gets rich when the interest rates are high because people can’t borrow money.”
Pompliano added that lowering interest rates would also benefit American consumers:
Related: Bitcoin dips to $80K in ‘ugly start,’ could retest key resistance: Hayes
CME FedWatch, a tool used to measure expectations for a Federal Reserve interest rate change, has tipped a 96% probability that the target rate will remain between 4.25% and 4.50% following the Federal Reserve’s next meeting on March 19. 
However, it’s near 50-50 odds for the target rate to be lowered in the Federal Reserve’s following meeting on May 7.
The Federal Reserve typically avoids lowering interest rates when inflation is high, as one of its primary objectives is to maintain price stability.
However, a Trump-inflicted recession, or “Trumpcession,” as some call it, could force America’s top bank to start cutting again.
Magazine: Meet lawyer Max Burwick — ‘The ambulance chaser of crypto’
",1741691704360,[],,2025-03-11T11:15:04.360619
