id,source,title,url,content,date,authors,image_url,scraped_at
",1743722073237,[],,2025-04-03T23:14:33.237115
461cdf1b145c2de1f0fb97fde28aa9a3,Cointelegraph,"Bitcoin drops 8%, US markets shed $2T in value — Should traders expect an oversold bounce?",https://cointelegraph.com/news/bitcoin-drops-8-us-markets-shed-2-t-in-value-should-traders-expect-an-oversold-bounce," Crypto and stock markets took heavy losses throughout the US trading session. Should traders expect a relief rally due to oversold conditions? 
Bitcoin (BTC) and US stock markets all sold off sharply after US President Donald Trump shook up financial markets by announcing a list of reciprocal tariffs on several countries. 
On April 3, the S&P 500 saw a 4.2% drop at market open, its most significant single-day decline since June 2020. The Dow Jones Industrial Average fell 3.41%, to 40,785.41 from 42,225.32, while the Nasdaq Composite dropped 5.23%. Overall, $1.6 trillion in value was wiped out from US stock at the market open. 
Bitcoin’s value dropped by 8%, but a positive is bulls seem capable of defending the $80,000 support level. These steep declines essentially stem from uncertainty surrounding the new tariffs and amplify investors’ concerns about impending recession.
Source: X
Data from CoinGecko suggests that the total crypto market has dropped 6.8% over the past 24 hours and it seems unlikely that a relief rally is viable in the short-term.
Related: Bitcoin price risks drop to $71K as Trump tariffs hurt US business outlook
According to CoinGlass, in the past 24 hours, more than 200,000 traders were liquidated, with the total amount exceeding $573.4 million. The largest liquidation occurred on Binance, with an ETH/USDT position worth $11.97 million being force closed.
Total crypto liquidation chart. Source: CoinGlass
Meanwhile, Bitcoin’s open interest dropped below $50 billion, reducing market leverage. Joao Wedson, CEO of Alphractal, mentioned that the liquidation heatmaps indicate heavy leverage around $80,000, raising the potential for a potential drop to $64K-$65K if Bitcoin breaks this level with high trading volume.
Bitcoin liquidation maps. Source: X
Related: Trump 'Liberation Day' tariffs create chaos in markets, recession concerns
This article does not contain investment advice or recommendations. Every investment and trading move involves risk, and readers should conduct their own research when making a decision.
",1743722076567,[],,2025-04-03T23:14:36.567676
b517369f48037b674748fcd5f6c50b0e,Cointelegraph,Bitcoin falls toward $80K and prints ‘death cross’ as US stocks mimic 2020 COVID-19 crash,https://cointelegraph.com/news/bitcoin-falls-toward-80-k-and-prints-death-cross-as-us-stocks-mimic-2020-covid-19-crash," Bitcoin’s pre-reciprocal US tariff gains evaporated as the S&P 500 prints intra-day losses not seen since the height of the COVID-19 sell-off in mid-2020. 
Bitcoin (BTC) hit new monthly lows at the April 3 Wall Street open as US unemployment data added to pressure on risk assets.
BTC/USD 4-hour chart. Source: Cointelegraph/TradingView
Data from Cointelegraph Markets Pro and TradingView confirmed the first trip below $82,000 for BTC/USD since the start of the month.
After initially surging as high as $88,580 as the US government unveiled reciprocal trade tariffs, Bitcoin soon ran out of steam as the reality of the stronger-than-expected measures hit home.
US stocks then followed, with the S&P 500 down over 4% on the day at the time of writing.
“Today's -3.7% drop puts the S&P 500 on track for its largest daily decline since the 2020 pandemic lockdowns,” trading resource The Kobeissi Letter wrote in part of a reaction on X. 
S&P 500 1-hour chart. Source: Cointelegraph/TradingView
Thereafter, US initial jobless claims came in below estimates, at 219,000 versus the anticipated 228,000, per data from the US Department of Labor (DoL).
“The previous week's level was revised up by 1,000 from 224,000 to 225,000. The 4-week moving average was 223,000, a decrease of 1,250 from the previous week's revised average. The previous week's average was revised up by 250 from 224,000 to 224,250,” an official press release stated.
Stronger labor market trends are traditionally associated with weaker risk-asset performance as they imply that policymakers can keep financial conditions tighter for longer.
Data from CME Group’s FedWatch Tool nonetheless continued to see markets favor an interest-rate cut from the Federal Reserve at the June meeting of the Federal Open Market Committee (FOMC).
Fed target rate probabilities (screenshot). Source: CME Group
“As recession odds rise, markets think that the Fed will be forced to cut rates as soon as next month,” Kobeissi added.
BTC price action predictably continued to disappoint on short timeframes as $80,000 support became uncomfortably close.
Related: Bitcoin price risks drop to $71K as Trump tariffs hurt US business outlook
“Stair step up then elevator down,” popular trader Roman summarized in part of his latest X analysis.
Market commentator Byzantine General flagged short positions increasing across major crypto pairs, concluding that tariffs would ensure that lackluster conditions would continue.
“I could see a stop hunt below the local lows before a pump to squeeze shorts, then probably more chop that slopes downward,” he told X followers. 
Bitcoin and Ethereum market data. Source: Byzantine General/X
Onchain analytics firm Glassnode had more bad news. According to their data, Bitcoin printed a new “death cross” involving the convergence of two midterm moving averages (MAs).
“An onchain analogue to the Death Cross has emerged. The 30-day volume-weighted price of $BTC has crossed below the 180-day, signaling weakening momentum,” an X post announced. 
Bitcoin realized price “death cross” impact data. Source: Glassnode/X
Earlier this week, Glassnode observed that speculative sell-offs in recent months have fallen considerably short of volumes traditionally associated with blow-off BTC price tops.
This article does not contain investment advice or recommendations. Every investment and trading move involves risk, and readers should conduct their own research when making a decision.

",1743703784861,[],,2025-04-03T18:09:44.861286
3fc6137fb4ad435b08efb98e9389adf5,Cointelegraph,How long will Bitcoin’s price consolidation last?,https://cointelegraph.com/news/how-long-will-the-bitcoin-consolidation-last," Bitcoin’s price consolidation looks set to continue as neutral funding rates and macroeconomic uncertainty highlight indecisiveness among traders. 
Bitcoin (BTC) price has been consolidating in a wide range between $80,000 to $88,500 since March 12. 
Data suggests that Bitcoin’s consolidation may continue for some time, with onchain indicators pointing to the continuation of the “broader downtrend.” The key question that remains is when Bitcoin’s consolidation will end.
BTC/USD daily chart. Source: Cointelegraph/TradingView
One of the clearest signs that there is more choppy price action ahead for Bitcoin is the presence of muted funding rates in the BTC futures markets.
Key points:
Funding rates are periodic payments made between long and short traders in perpetual futures contracts to keep prices aligned with the spot market.
When this metric turns negative, it means short sellers are paying long holders, indicating that bearish sentiment dominates.
BTC funding rates have been oscillating around 0% since late February, indicating indecisiveness dominates the market.
BTC perpetual futures funding rates across all exchanges. Source: Glassnode
When funding rates are zero, the cost of holding positions is minimal, reducing pressure on traders to exit longs or shorts and leading to price consolidation.
Commenting on the funding rate, crypto analyst Axel Adler Junior said that Bitcoin’s average funding rate on major exchanges “has dropped into negative territory,” currently sitting just above zero.
According to the analyst, positive signals from the US Federal Reserve and the Trump administration could renew fresh inflows into the market, “potentially triggering the start of a new rally.”
Several onchain metrics suggest Bitcoin’s April 2 rally to $87,500 was just a “relief rally within a broader downtrend rather than the beginning of a sustained reversal,” according to market intelligence firm Glassnode.
In its latest market report, Glassnode found that the 90-day simple moving average of Bitcoin’s Realized Profit/Loss Ratio had declined significantly since January, despite repeated rallies in the $76,000–$80,000 range.
These brief profit-driven surges have failed to end the ongoing consolidation, suggesting that the “macro picture remains one of generally weaker liquidity and deteriorating investor profitability,” it said.
Bitcoin: Realized profit and loss ratio. Source: Glassnode
An accompanying chart shows data from the onchain volume-weighted prices metric, which calculates a price level weighted by the volume of coins moved onchain over a specific timeframe.
Using this, Glassnode can compare when and how much capital was actually moved in the last 1 month compared to the last 6 months, giving a direct reflection of market trends.
The recent cross-over of the short-term 1-month average below the long-term 6-month price indicates an onchain “death cross,” Glassnode said.
Bitcoin: Realized price inter-cycle cohort age. Source: Glassnode
Anticipation of a breakout in BTC price lingers in the background, as suggested by Bitcoin’s volatility indicator.
Key points:
Tightening Bollinger Bands conditions indicate that a breakout might be very close.
The weekly Bollinger Bandwidth is at an extremely oversold level, touching its lower green line.
The width of the Bollinger Bands is as tight as it was between July 2024 and November 2024 when it consolidated between $55,000 and $69,000, the 2021 all-time high.
BTC/USD then rallied 60% from $67,500 in October 2026 to its previous high of $106,000 reached in December 2024.
The indicator was also this tight between July 2023 and October 2023, preceding a 176% rally in BTC price from $24,400 to $73,800 on March 14, 2024.
BTC/USD daily chart. Source: Cointelegraph/TradingView
If history repeats itself, Bitcoin could soon break out of consolidation to stage a massive upward move over the next few weeks.
This article does not contain investment advice or recommendations. Every investment and trading move involves risk, and readers should conduct their own research when making a decision.
",1743703788319,[],,2025-04-03T18:09:48.319853
427cd74b29c3cbf0c8aaa6ad5940986b,Cointelegraph,Beyond the hype: How Bitcoin stays true to its values,https://cointelegraph.com/news/beyond-the-hype-how-bitcoin-stays-true-to-its-values," Beyond price swings and media hype, Bitcoin continues to evolve while staying true to its core values. The latest episode of The Clear Crypto Podcast looks at Bitcoin’s scalability, security and its future as a global financial force. 
Bitcoin’s (BTC) journey from a radical experiment to a trillion-dollar asset has been fueled by grand narratives: Digital gold, decentralized money and an alternative financial system. Beyond the hype, how does Bitcoin remain true to its core values? 
That’s the central theme of the latest episode of The Clear Crypto Podcast, where hosts Nathan Jeffay and Gareth Jenkinson are joined by Charlie Spears, co-founder of Blockspace Media, to unpack Bitcoin’s evolving role in the global financial system.
From the outset, Bitcoin was designed as a decentralized alternative to traditional money.
But as adoption has surged, so too has the debate over its scalability and usability. Jenkinson began the conversation by explaining the origins of the original cryptocurrency and how that has shifted over time:
The discussion underscores the growing importance of layer-2 solutions like the Lightning Network, which aim to make Bitcoin practical for everyday transactions by enabling users to transact in satoshis — the smallest unit of Bitcoin — rather than traditional currencies.
Related: 4 key Bitcoin metrics suggest $80K BTC price is a discount
Debates over Bitcoin’s direction often center on its philosophical roots. Some purists argue that any modification risks altering the essence of what makes Bitcoin unique. 
Others see thoughtful updates as a way to reinforce its role as a global financial system. Spears compares this to interpreting historical texts: 
The discussion highlights how some proposed upgrades aren’t new but were initially removed as a precaution. Now, with Bitcoin’s maturity, developers are considering reinstating them to improve functionality. 
“Bitcoin is in the hands of its users,” Spears emphasizes. “We get to decide what it should be, just as much as those who were there 15 years ago.”
As Bitcoin continues to evolve, The Clear Crypto Podcast cuts through the noise to deliver insightful conversations about where it’s headed next. 
To hear the full conversation on The Clear Crypto Podcast,  listen to the full episode on Cointelegraph’s Podcasts page, Apple Podcasts or Spotify. And don’t forget to check out Cointelegraph’s full lineup of other shows! 
Magazine: SEC’s U-turn on crypto leaves key questions unanswered
",1743703791407,[],,2025-04-03T18:09:51.407145
72a3b2e9eb98f9e264f44728c79324f1,Cointelegraph,CEX listings outperform Nasdaq and Dow IPOs with 80% average returns,https://cointelegraph.com/news/crypto-token-listings-outperform-stocks-80-roi," CEX listings had an average return of over 80% during the past 180 days, outperforming the NYSE and Nasdaq’s average IPO returns. 
Cryptocurrency listings have outperformed the average of traditional stock listings, despite recent community criticism regarding the manipulation potential of token listings on centralized exchanges.
Token listing procedures on centralized cryptocurrency exchanges (CEXs) drew significant controversy after Changpeng “CZ” Zhao, co-founder and former CEO of Binance, called the process flawed after disappointing performances of some token listings.
Despite the criticism, crypto exchanges have outperformed traditional stock exchanges in terms of listings with positive returns on investment (ROI) and average ROI, according to an April 3 CoinMarketCap report shared exclusively with Cointelegraph.
Over the past 180 days, crypto exchange listings had an average return of over 80%, outperforming the largest traditional stock indexes such as the Nasdaq and Dow Jones, as well as Bitcoin (BTC) and Ether (ETH).
CEX listings, top indexes, average ROI. Source: CoinMarketCap
The 80% return refers to the average performance of all listed tokens by the seven major exchanges, including Binance, Bybit, Coinbase, OKX, Bitget, Gate and KuCoin.
Moreover, 68% of crypto exchange listings boasted a positive ROI, outperforming the New York Stock Exchange’s (NYSE) 54% and the Nasdaq’s 51%.
Source: CoinMarketCap
“This data suggests that crypto exchanges have made progress in refining their listing,” the report said.
=======
556d53f2df00a6ff990cbe879c202f3d,Cointelegraph,Trump’s Liberation Day: ‘Climax of uncertainty’ before crypto market recovery,https://cointelegraph.com/news/trump-liberation-day-climax-uncertainty-crypto-market-recovery," “In my opinion, the tariffs are the representation of the uncertainty in the markets,” Michaël van de Poppe told Cointelegraph 
Cryptocurrency markets could be on track for recovery as investor sentiment begins to stabilize following US President Donald Trump’s sweeping tariff announcement — what some analysts are calling the peak of recent market uncertainty.
Trump announced his reciprocal import tariffs on April 2, which sent tremors across global markets. The S&P 500 lost more than $5 trillion, its largest drop on record, surpassing the pandemic-induced crash in March 2020, according to Reuters.
Still, some analysts see a silver lining to the tariff announcement.
“In my opinion, the tariffs are the representation of the uncertainty in the markets,” Michaël van de Poppe, founder of MN Consultancy, told Cointelegraph. “Liberation Day is basically the peak of that period, the climax of uncertainty. Now it’s out in the open. Everybody knows the new playing field.”
Van de Poppe added that he believes Trump is using tariffs as a strategic move to stimulate domestic growth and reduce yields. “Tariffs are literally the only way to do that,” he said. “I wouldn’t be surprised if they’re reversed within the next six to 12 months.”
Average tariff rate on US goods and imports. Source: JPMorgan, Ayesha Tariq
President Trump’s plan imposes a 10% baseline tariff on all US imports from April 5 and a higher “reciprocal tariff” of up to 54% on select countries with larger trade deficits from April 9.
Related: Michael Saylor’s Strategy buys Bitcoin dip with $1.9B purchase
Still, the end of the uncertainty could bring renewed investment into crypto markets, leading to a recovery, Van de Poppe said:
He noted that the economic impact of the tariffs may ultimately lead the US Federal Reserve to lower interest rates and begin a new round of quantitative easing (QE), a monetary policy that involves the Fed buying bonds to inject liquidity into the economy.
Arthur Hayes, co-founder of BitMEX and chief investment officer at Maelstrom, has predicted Bitcoin could climb to $250,000 if the Fed formally enters a QE cycle.
Related: Satoshi Nakamoto turns 50 as Bitcoin becomes US reserve asset
On the downside, the tariff-related uncertainty may continue pressuring risk asset appetite for weeks, according to Noelle Acheson, author of the Crypto is Macro Now newsletter.
“We can count on President Trump changing his mind a few times within the first couple of weeks,” Acheson told Cointelegraph. She added:
“For crypto, BTC continues to act like a risk asset short-term while its analog counterpart gold breaks through one all-time high after another,” a development that may impact crypto investor sentiment in the short term, Acheson said.
Meanwhile, crypto intelligence firm Nansen estimated a 70% probability that the market could bottom by June, depending on how the tariff negotiations evolve.
Magazine: Bitcoin ATH sooner than expected? XRP may drop 40%, and more: Hodler’s Digest, March 23 – 29
",1743963179689,[],,2025-04-06T18:12:59.689179
c43f72eb84509cddc953e82486627eca,Cointelegraph,Here’s what happened in crypto today,https://cointelegraph.com/news/what-happened-in-crypto-today," Need to know what happened in crypto today? Here is the latest news on daily trends and events impacting Bitcoin price, blockchain, DeFi, NFTs, Web3 and crypto regulation. 
Today in crypto, the Chicago Mercantile Exchange (CME) Group announced the launch of Solana futures contracts in March. Meanwhile, global trade concerns continue pressuring investor sentiment, risking a potential Bitcoin correction below the key $75,000 support level. In addition, the US Securities and Exchange Commission has released a statement saying it does not view memecoins as securities.
The Chicago Mercantile Exchange (CME) Group, a globally recognized derivatives exchange, announced it will launch Solana (SOL) futures contracts on March 17, pending a review by United States financial regulators.
According to the Feb. 28 announcement, market participants will have access to micro contracts of 25 SOL or standard contract sizes of 500 SOL, and all contracts will be cash-settled. CME Group already provides futures and options contracts for Bitcoin (BTC) and Ether (ETH) to investors looking to hedge against the highly volatile nature of these digital assets.
The addition of Solana futures contracts gives traditional finance investors additional exposure to the crypto markets and provides the crypto markets with fresh capital injections that should support prices.
CME open interest on derivatives contracts quarter-by-quarter 2024. Source: CME Group
Bitcoin risks more downside if it loses a “key” $75,000 support amid growing concerns over a potential trade war between the United States and China.
Bitcoin’s (BTC) price has fallen more than 6.5% during the past 24 hours to sink below a low of $78,197, which was last seen on Nov. 10, 2024, Cointelegraph Markets Pro data shows.
Analysts attribute the current decline to macroeconomic concerns related to a potential trade war between the US and China caused by US President Donald Trump’s decision to impose import tariffs.
BTC/USD, 1-year chart. Source: Cointelegraph
These macroeconomic concerns were the main reason for Bitcoin losing the $80,000 support, according to Ryan Lee, chief analyst at Bitget Research.
The analyst told Cointelegraph:
Still, some analysts are concerned that Bitcoin’s correction may see the world’s first cryptocurrency revisit $70,000.
Based on its correlation with the global liquidity index, Bitcoin’s right-hand side (RHS), which marks the lowest bid price someone is willing to sell the currency for, may fall below $70,000 around the end of February, after it peaked near $110,000 in January.
The US Securities and Exchange Commission says it does not view memecoins as securities but warned any fraudulent tokens could still be subject to enforcement actions by other regulators.
The agency’s Division of Corporation Finance said in a Feb. 27 statement that, in its view, memecoins “do not involve the offer and sale of securities under the federal securities laws” and “are akin to collectibles.”
Source: David Sacks
“As such, persons who participate in the offer and sale of meme coins do not need to register their transactions with the Commission,” the SEC said.
It added that memecoin buyers and holders wouldn’t be protected by US securities laws but said the fraudulent offer and sale of memecoins “may be subject to enforcement action or prosecution by other federal or state agencies.”
",1740780816989,[],,2025-02-28T22:13:36.989672
05bd5a079ccdf8eba13866d21e34ce17,Cointelegraph,"No country wins a global trade war, BTC to surge as a result: Analyst",https://cointelegraph.com/news/no-country-wins-global-trade-war-btc-surge-result," Inflation, geopolitical tensions, high debt, and macroeconomic turmoil will eventually break the backbone of the current financial order. 
US President Donald Trump's trade policies will create worldwide macroeconomic turmoil and short-term financial crises that will ultimately lead to greater adoption of Bitcoin (BTC) as a store of value asset, according to Bitwise analyst Jeff Park.
Economic instability from the trade war will cause governments to adopt inflationary fiscal and monetary policies, which will further debase currencies and lead to a worldwide flight to safety in alternative stores of value, like Bitcoin, Park argued. 
This increased demand for BTC will drive prices much higher in the long term, the analyst concluded. In an X post on Feb. 2, Park predicted the immediate impact of a trade war:
Despite the Increased demand for Bitcoin as a store of value against rapidly depreciating fiat currencies driving BTC prices higher in the long term, global financial markets would feel the short-term pain and wealth destruction of the trade war, according to Park.
Bitcoin hit with short-term price shock due to Covid-19 in March 2020 before rallying to all-time highs during the 2020-2021 bull market. Source: TradingView
Related: Trump 'Liberation Day' tariffs create chaos in markets, recession concerns
Tariffs are ""stagflationary for the world as a whole,"" economist and hedge fund manager Ray Dalio wrote in an April 2 X post. Tariffs tend to be more deflationary for the levied goods producers and more inflationary for the importing country, Dalio added.
He concluded that the level of debt and trade imbalances will ultimately lead to a global financial shift that changes the established monetary order.
The US stock market experienced a dramatic sell-off in the wake of sweeping trade tariffs from the Trump admin. Source: TradingView
""If these trade tariffs do lead to a massive trade war, it is going to be very ugly for the whole world,"" Coin Bureau founder and market analyst Nic Puckrin told Cointelegraph in an interview.
The analyst said the US economy has a 40% chance of a recession in 2025 amid fears of a lengthy trade war and the macroeconomic uncertainty brought on by protectionist trade policies.
Asset manager Anthony Pompliano recently speculated that the US president is deliberately crashing capital markets to force interest rate cuts and lower the costs of servicing the US national debt.
Interest rate on the 10-year US Treasury Bond has come down since the start of Trump’s second term. Source: TradingView
The interest rate on 10-year US Treasury bonds declined from approximately 4.66% in January to the current rate of 4.00%.
Pompliano also concluded that while the current US administration's policies will create short-term pain, the effect of lower interest rates will encourage borrowing and drive risk-on asset prices higher in the long term.
Magazine: Bitcoin dominance will fall in 2025: Benjamin Cowen, X Hall of Flame
",1743870924452,[],,2025-04-05T16:35:24.452072
