id,source,title,url,content,date,authors,image_url,scraped_at
<<<<<<< HEAD
<<<<<<< HEAD
925f1c7123fc3565809962e7230de40c,Cointelegraph,US court fines UAE crypto firm CLS Global $428K for wash trading,https://cointelegraph.com/news/us-court-fines-cls-global-428000-wash-trading," CLS Global is one of the “victims” of the FBI’s trap token NexFundAI, alongside Hong Kong-linked ZM Quant Investment and Russia-linked Gotbit Consulting. 
Authorities in the US state of Massachusetts continue targeting unlawful cryptocurrency market practices, with a local court fining crypto financial services firm CLS Global.
A federal court in Boston on April 2 sentenced CLS Global on criminal charges related to fraudulent manipulation of crypto trading volume, according to an announcement from the Massachusetts US Attorney’s Office.
In addition to a $428,059 fine, the court prohibited CLS Global from offering services in the US for a probation period of three years.
CLS Global, a crypto market maker registered in the United Arab Emirates, in January pleaded guilty to one count of conspiracy to commit market manipulation and one count of wire fraud.
The charges against CLS Global followed an undercover law enforcement operation involving NexFundAI, a token created by the FBI as part of a sting operation in May 2024.
CLS Global was among at least three firms that took the FBI’s bait and agreed to provide “market maker services” for NexFundAI, including a fraudulent scheme to attract investors to purchase the token.
In October 2024, the Securities and Exchange Commission announced fraud charges against CLS and its employee, Andrey Zhorzhes. The US securities regulator also filed complaints against two other NexFundAI manipulators, Hong Kong-linked ZM Quant Investment and Russia-linked Gotbit Consulting.
According to CLS Global CEO Filipp Veselov, the company was founded in 2017 to fill in a “huge gap in the market for high-quality market-making solutions and trading consulting.”
Prior to CLS, Veselov worked at the Russian cryptocurrency exchange platform Latoken, which is advertised as a “global digital asset exchange” and has about 370,000 followers on X.
The CLS team also includes chief revenue officer Pavel Singaevskii, who previously served as sales manager at Stex, a crypto platform that reportedly ceased operations without warning in 2023.
Source: CLS Global
According to CLS Global’s X page, the platform continues operating and has more than 110,000 followers at the time of publication.
Wash trading is an illegal practice involving artificially inflating trading volume by repeatedly buying and selling the same asset, generating a misleading perception of demand.
According to a January 2025 report by the US blockchain analytics firm Chainalysis, the crypto market has at least $2.6 billion in estimated wash traded volumes, or just about 2% of total daily crypto trading volumes, as reported by CoinGecko.
Estimated wash trade volume in crypto. Source: Chainalysis
Related: Russian Gotbit founder strikes $23M plea deal with US prosecutors
Some studies indicate that wash trading makes up a bigger share of the crypto market.
In 2022, the US National Bureau of Economic Research reported that illegal wash trading may account for as much as 70% of average trading volumes on unregulated exchanges.
Magazine: Financial nihilism in crypto is over — It’s time to dream big again
",2025-04-04 11:26:43.849333,[],,2025-04-04T11:26:43.849333
2e146482a6eadc0e3d9e7d62aa7a43bf,Cointelegraph,Bitcoin DeFi surge may boost BTC demand and adoption — Binance,https://cointelegraph.com/news/bitcoin-demand-skyrocket-2-700-bitcoin-defi-surge," The growing BTCFi sector and potential interest rate cuts on the horizon may create more demand for Bitcoin as a productive, yield-bearing asset. 
The value locked in Bitcoin-based decentralized finance (BTCFi) has surged by more than 2,700% over the past year, potentially transforming Bitcoin from a passive store of value into a productive, yield-bearing asset, according to new research from Binance.
BTCFi is a new technological paradigm that aims to bring decentralized finance capabilities to Bitcoin’s base layer. It is one of the fastest-growing crypto sectors, reaching a total value locked (TVL) of over $8.6 billion.
The growing value of BTCFi, “along with potential interest rate cuts, may reinforce positive sentiment for Bitcoin in the medium and long term,” Binance Research wrote in a report shared with Cointelegraph.
Bitcoin DeFi, total value locked, 2025 chart. Source: Binance Research
If the BTCFi sector’s growth trajectory continues, it could open up “new opportunities for Bitcoin holders to generate yield through lending, liquidity provision, and other DeFi mechanisms,” a Binance spokesperson told Cointelegraph, adding:
Related: Bitcoin price can hit $250K in 2025 if Fed shifts to QE: Arthur Hayes
Interest in BTCFi surged after April 2024’s Bitcoin halving, which introduced the Runes protocol, the first fungible token standard on the Bitcoin blockchain.
Several Bitcoin-native projects have helped accelerate the trend. 
Babylon introduced Bitcoin (BTC) staking for the first time in the network’s history, enabling holders to earn passive income from their assets.
Hermetica launched the first Bitcoin-backed synthetic dollar, USDh, which debuted with a 25% yield for investors.
Related: Crypto trader turns $2K PEPE into $43M, sells for $10M profit
Long-term Bitcoin holders have restarted their BTC accumulation after the BTC supply held by long-term holders bottomed in February.
BTC supply held by long-term holders. Source: Glassnode, Binance Research
Long-term holders are wallets that have been holding BTC for at least 155 days. Growing accumulation from long-term holders has reduced the available Bitcoin supply on exchanges, which may eventually lead to a supply shock-driven price rally.
The growing accumulation trend among long-term holders aligns with a “significant period of adoption for Bitcoin,” due to the establishment of the US strategic Bitcoin reserve and growing institutional interest, according to the research report.
Source: Margo Martin
On March 7, US President Donald Trump signed an executive order to create a strategic Bitcoin reserve using BTC seized from government criminal cases.
Trump signed the historic Bitcoin reserve order a day ahead of hosting the first White House Crypto Summit, which received mixed reactions from the crypto community.
Magazine: Bitcoiner sex trap extortion? BTS firm’s blockchain disaster: Asia Express
",2025-04-04 11:26:47.557357,[],,2025-04-04T11:26:47.557357
=======
>>>>>>> ec043c9e9722c533bd319f226c0ca43ac0007681
fcd1faa605205566dd6a2290ce45d167,Cointelegraph,How to sell crypto via MetaMask: A beginner’s guide to cashing out,https://cointelegraph.com/news/how-to-sell-crypto-via-meta-mask," To sell crypto via your MetaMask wallet, you need to be aware of swapping, bridging and using fiat off-ramps to convert your crypto into fiat. 
Not all tokens can be sold immediately. Airdropped or obscure tokens may lack liquidity or could be scams, so it’s important to check before attempting to cash out.
Swapping and bridging may be required. To sell, you might need to convert tokens to ETH or stablecoins and bridge them to the Ethereum mainnet.
MetaMask integrates fiat off-ramps. You can use the MetaMask Portfolio to sell ETH directly, but be prepared for KYC with third-party providers.
Non-KYC and P2P options exist. Platforms like Bisq or LocalCoinSwap allow trading without ID, but they carry more risk and require caution.
There are plenty of ways you might end up with a mix of different cryptocurrencies sitting in your MetaMask wallet.
Maybe you work in Web3 — as a developer, copywriter or designer — and your client paid you in their project’s native token.
Or maybe you’re part of a Bitcoin mining pool and occasionally receive rewards straight to your wallet.
You could be farming yield in decentralized finance (DeFi), earning annual percentage yield (APY) on your locked assets. Or, perhaps the most straightforward of all: You completed a few SocialFi tasks and received some community tokens via an airdrop.
Whatever the case, you’ve got crypto in your MetaMask — and now you want to turn it into cash.
In this guide, you’ll learn all the ways you can sell your crypto and withdraw the funds to your bank account or even in cash — whether you’re going through official Know Your Customer (KYC) channels or sticking to more private, non-KYC routes.
Before you can turn your tokens into cash, there are a few things you need to get sorted in MetaMask because “not all tokens are created equal.” It’s not always as simple as hitting a “sell” button — especially if you’ve just received tokens via an airdrop or from a lesser-known project.
Just because a token shows up in your wallet doesn’t mean it’s ready to be sold. In fact, many airdropped tokens aren’t listed on exchanges at all. That means there’s no market where you can sell them — not yet, anyway. You might see a price attached to the token, but without buyers or liquidity, that value isn’t something you can actually realize right now. So, while it’s great to receive free tokens, they may end up sitting idle in your wallet for a while.
Did you know? If you see a “100% sell fee detected” warning on a token, it’s likely a scam. Scammers airdrop these tokens, hoping you’ll try to sell or interact with them. But when you do, the smart contract takes the full amount — leaving you with nothing. Worse, some link to fake decentralized applications (DApps) that ask you to “claim” or “unlock” the tokens. Connecting your wallet or signing a transaction there can let scammers drain your real assets.
Sometimes, you’ll receive tokens that don’t even show up in MetaMask at first. That doesn’t mean they’re not there — it just means MetaMask doesn’t recognize them by default. You’ll need to add them manually by grabbing the token’s contract address (usually from the project’s official site or Etherscan) and importing it into your wallet. Once you do that, your balance will show up properly.
Similarly, if you want to receive any asset other than Ether (ETH), the “Import Tokens” option lets you manually add these missing tokens so they show up in the assets list.
Even if your tokens are visible in MetaMask and technically have value, that doesn’t always mean you can sell them for cash right away. Many smaller or newer tokens don’t have direct fiat trading pairs — so you won’t be able to exchange them straight into dollars or euros. 
To get around this, you’ll usually need to swap them for something more liquid, like ETH or a stablecoin such as USDC (USDC), which are more commonly supported by fiat off-ramps.
In some cases, your tokens might also be sitting on a different blockchain — like Arbitrum, BNB Chain or Polygon — while most fiat withdrawal options only support Ethereum mainnet. When that’s the case, you’ll need to bridge your tokens over to Ethereum before you can sell them.
One way to handle both of these steps — swapping and bridging — is by using platforms that combine them into a single flow. For example, with Symbiosis.finance, you can swap a token on one chain and receive a more widely accepted token on Ethereum, all in one transaction. This can save you a few steps and reduce the chance of user error when hopping between tools.
The simplest way to sell crypto that you hold on MetaMask is by using the application itself. Here’s what to do:
Open MetaMask portfolio: In your MetaMask extension or app, click the “Buy & Sell” button. This will take you to the MetaMask Portfolio site, where you can manage all your assets and begin the selling process.
Start the sale process: Click on “Move crypto” at the top of the page and select “Sell” from the dropdown options.
Choose your region and currency: MetaMask will ask for your country of residence and preferred fiat currency. This step ensures you’re shown accurate provider options and payout methods available in your area.
Enter sale amount: Select Ether and enter how much you’d like to convert.
Pick a payout option: Next, choose where you want the fiat to go. Depending on your region and provider availability, you might be able to send it to a bank account, PayPal or another method.
Compare offers: MetaMask aggregates offers from several third-party providers (like MoonPay, Transak, Sardine, etc.), showing you real-time exchange rates, fees and estimated payout times. Take a moment to compare and pick the best option for you.
Complete the sale: Once you’ve chosen a provider, MetaMask will guide you through sending the crypto. You’ll confirm the transaction in your wallet, and the funds will be transferred to the provider, who handles the fiat payout.
There are two things to keep in mind when using the MetaMask application:
Firstly, while the application itself might not ask you for KYC, the third-party providers will. So, expect to get your documents ready for this one.
Secondly, MetaMask’s sell feature only supports ETH on the Ethereum mainnet. This is where the bridging will come in as was explained earlier.
If you’d rather cash out your crypto through a centralized exchange, Coinbase is a popular option. It’s beginner-friendly, offers fiat withdrawals, and supports a wide range of assets. Just note: You’ll need to complete KYC verification before withdrawing any fiat.
Here’s how to do it, step by step:
First things first: You’ll need to move your funds from MetaMask to Coinbase.
Log in to your Coinbase account and hit “Send & Receive” at the top.
Switch to the “Receive” tab, pick the crypto you’re sending (like ETH or USDC), and copy the wallet address Coinbase gives you.
Make sure the network matches — for example, if you’re sending ETH, it should be on the Ethereum (ERC-20) network.
Now open MetaMask:
Click “Send,” paste in that Coinbase address, and enter how much you want to transfer.
Double-check the network — if you send it to the wrong one, your funds could disappear.
Hit “Confirm,” and your crypto should show up in Coinbase after a few minutes.
Once your funds land in Coinbase, it’s time to cash out.
Head to “Buy & Sell” at the top and switch to the “Sell” tab.
Choose the crypto you just received and decide how much you want to sell.
Pick where you want the money to go — like your linked bank account, PayPal or your Coinbase balance.
Review the details (including any fees), then hit “Sell.”
Did you know? When withdrawing via centralized exchanges, be cautious of minimum withdrawal amounts and any associated fees. Check these details in advance to make sure the limits and costs are acceptable to you before committing to this route.
With peer-to-peer (P2P), you’re not selling your crypto to the exchange. Instead, you’re selling it to another user. You choose a buyer based on their offer and preferred payment method (like bank transfer, Revolut, Wise, etc.). Once they send the money to your account, you release the crypto to them. The platform holds your crypto in escrow during the process, so no one can just disappear with your funds.
With centralized exchanges, you’ll have to complete KYC before you’re able to trade in this manner. 
Go to Trade > P2P.
Choose the coin you want to sell and browse the list of available buyers.
Select a deal, confirm the order, and wait for the buyer to make the payment.
Once the payment has arrived in your account, confirm it and release the crypto from escrow.
Did you know? Some peer-to-peer (P2P) cryptocurrency exchanges offer a “cash by mail” option, allowing users to send physical cash through postal services or couriers to settle transactions.
For those looking to convert cryptocurrency from their MetaMask wallet to fiat currency without undergoing Know Your Customer (KYC) verification, there are still a few viable paths.
Decentralized P2P platforms let you trade directly with other users, much like their centralized counterparts, though often with minimal or no KYC requirements. 
LocalCoinSwap: A non-custodial P2P marketplace that supports a wide range of cryptocurrencies and payment methods, including cash. It offers escrow protection and emphasizes privacy.
Bisq: A fully decentralized exchange that supports a variety of cryptocurrencies, including Bitcoin and Monero (XMR). It runs on a peer-to-peer protocol and doesn’t require user accounts or KYC.
However, without KYC, you’re responsible for vetting the person you’re trading with. Check their reputation, review any available trade history, and always follow platform safety guidelines.
Withdrawing funds from your MetaMask wallet using cryptocurrency ATMs — often referred to as Bitcoin ATMs — is an option that allows you to convert your digital assets into cash. Here’s how you can approach this method:
Locate a cryptocurrency ATM: Begin by finding a cryptocurrency ATM in your vicinity. Websites like CoinATMRadar provide directories of Bitcoin ATM locations worldwide, detailing the services they offer and the cryptocurrencies they support.
Prepare your MetaMask wallet: Ensure that the cryptocurrency you intend to withdraw is supported by the ATM. Bitcoin ATMs predominantly support Bitcoin (BTC), so you may need to use a decentralized exchange (DEX) to swap your current tokens for BTC within your MetaMask wallet. Be mindful of transaction fees and exchange rates during this process.
Initiate the withdrawal process: At the ATM, select the option to withdraw cash. The machine will prompt you to specify the amount you wish to withdraw and provide a QR code representing the ATM’s wallet address.
Transfer funds from MetaMask: Using your MetaMask wallet, scan the QR code provided by the ATM to input the recipient address accurately. Enter the exact amount of cryptocurrency required and confirm the transaction. Be aware that network congestion can affect transaction times.
Collect your cash: Once the blockchain confirms the transaction, the ATM will dispense the equivalent amount in cash, minus any applicable fees. This process can take anywhere from a few minutes to longer, depending on network conditions.
When using crypto ATMs, you should expect very high fees, and while small transactions don’t usually require KYC, larger ones still might.
Taxes aren’t the most exciting topic, but they matter when converting crypto from a MetaMask wallet into fiat. Selling crypto, whether through MetaMask, an exchange or a P2P deal, may trigger a taxable event, and understanding the applicable rules is essential.
In most countries, including the US, selling crypto for fiat (like US dollars, euros, etc.) is treated like selling property. That means if you bought ETH at $1,000 and sold it later for $1,500, you’ve made a $500 capital gain — and that’s usually taxable.
Even swapping one crypto for another (say, ETH for USDC) can trigger the same kind of tax obligation, even if no fiat is involved. So, yeah, it’s not just cashing out that counts — any trade can be reportable.
To stay on top of it, keep a record of:
When you bought and sold each asset
How much you bought and/or sold
What it was worth in fiat at the time
Any fees paid along the way.
These details make life way easier when tax season rolls around — or if your accountant gives you that look.
Crypto laws aren’t one-size-fits-all. Every country has its own stance, and even within the same country, rules can vary depending on how you’re using crypto.
In the US, for example, selling crypto could fall under capital gains tax rules or even money transmission laws, depending on how you’re moving the funds. Other countries might have more lenient — or much stricter — regulations.
So, here’s what to do:
Look up your local crypto tax laws (even if they seem vague or outdated).
Stay current — regulations are evolving fast.
Talk to a pro if you’re unsure. A crypto-savvy accountant or legal adviser can help you avoid nasty surprises.
Even if you’re using non-KYC methods or decentralized tools, tax authorities may still expect a full report. Being proactive about it will save you headaches later — and might even save you money.
Happy cashing out!

<<<<<<< HEAD
",2025-04-04 11:26:51.011122,[],,2025-04-04T11:26:51.011122
2930342e49179a5f6f3a7f445b809635,Cointelegraph,Babylon users unstake $21M in Bitcoin following token airdrop,https://cointelegraph.com/news/babylon-21-million-unstaked-baby-airdrop," Over $21 million in Bitcoin was unstaked from Babylon as early users claimed 600 million BABY tokens in the platform’s latest airdrop. 
More than $21 million worth of Bitcoin was unstaked from the Babylon protocol in the 24 hours after the platform’s token airdrop, according to blockchain data shared by a developer.
On April 4, Bitfeed developer Mononaut shared that in the previous 24 hours, 256 Bitcoin (BTC) had been unstaked from the staking protocol. Mononaut said that the unstaking transactions paid 1.35 BTC in fees and consumed 1.318 Megavirtualbytes (MvB) of blockspace. This means the transactions generated high fees and occupied roughly a third of an entire Bitcoin block. 
The activity followed Babylon’s 600 million airdrop of its native token, BABY, which was distributed to early users and contributors.
Related: Bitcoin L2 ’honeymoon phase’ is over, most projects will fail — Muneeb Ali
In a previous Cointelegraph interview, Babylon co-founder Fisher Yu said that, unlike Ethereum and Solana, Bitcoin staking does not reward stakers in the chain’s native asset. Instead, they may get rewards in the form of the native token of the blockchain secured by the staked Bitcoin capital. 
On April 3, the Babylon Foundation announced the details of the airdrop program for its early adopters. The protocol said the airdrop was dedicated to its Phase 1 stakers, non-fungible token (NFT) holders and developers contributing to its ecosystem. 
The staking protocol said it was airdropping 600 million BABY tokens, 6% of its total supply; 30 million BABY were allocated to the protocol’s Pioneer Pass NFT holders, while 5 million BABY were slated for open-source contributors. 
The rest of the tokens were to be distributed among eligible stakers who participated in the protocol’s Phase 1. This included a stake participation airdrop of 30 million BABY, a base staking reward airdrop of 335 million BABY and a bonus staking reward airdrop for Phase 2 transition of 200 million BABY.  
While the platform distributed an airdrop for its early adopters, it clarified that it did not include wallet campaigns and liquid staking incentives in this airdrop event. 
In response to the airdrop, crypto exchange OKX listed the BABY token and USDT pair in pre-market futures. Pre-market futures allow traders to speculate on an asset’s future price. This allows investors to trade BABY futures before the asset becomes available in spot markets.
Data platform DefiLlama shows that Babylon currently has a total value locked (TVL) of $4.29 billion. This represents 80% of the Bitcoin ecosystem’s overall TVL of $5.34 billion. 
Magazine: New ‘MemeStrategy’ Bitcoin firm by 9GAG, jailed CEO’s $3.5M bonus: Asia Express
",2025-04-04 11:26:54.639330,[],,2025-04-04T11:26:54.639330
