id,source,title,url,content,date,authors,image_url,scraped_at
72a3b2e9eb98f9e264f44728c79324f1,Cointelegraph,CEX listings outperform Nasdaq and Dow IPOs with 80% average returns,https://cointelegraph.com/news/crypto-token-listings-outperform-stocks-80-roi," CEX listings had an average return of over 80% during the past 180 days, outperforming the NYSE and Nasdaq’s average IPO returns. 
Cryptocurrency listings have outperformed the average of traditional stock listings, despite recent community criticism regarding the manipulation potential of token listings on centralized exchanges.
Token listing procedures on centralized cryptocurrency exchanges (CEXs) drew significant controversy after Changpeng “CZ” Zhao, co-founder and former CEO of Binance, called the process flawed after disappointing performances of some token listings.
Despite the criticism, crypto exchanges have outperformed traditional stock exchanges in terms of listings with positive returns on investment (ROI) and average ROI, according to an April 3 CoinMarketCap report shared exclusively with Cointelegraph.
Over the past 180 days, crypto exchange listings had an average return of over 80%, outperforming the largest traditional stock indexes such as the Nasdaq and Dow Jones, as well as Bitcoin (BTC) and Ether (ETH).
CEX listings, top indexes, average ROI. Source: CoinMarketCap
The 80% return refers to the average performance of all listed tokens by the seven major exchanges, including Binance, Bybit, Coinbase, OKX, Bitget, Gate and KuCoin.
Moreover, 68% of crypto exchange listings boasted a positive ROI, outperforming the New York Stock Exchange’s (NYSE) 54% and the Nasdaq’s 51%.
Source: CoinMarketCap
“This data suggests that crypto exchanges have made progress in refining their listing,” the report said.
Related: 70% chance of crypto bottoming before June amid trade fears: Nansen
Cryptocurrencies listed on CEXs generally see high demand from investors as the exchanges provide significant new liquidity that can boost the coins’ price performances after listing.
Token-listing criteria on CEXs started garnering attention in November 2024, after Tron founder Justin Sun claimed that Coinbase allegedly asked for $330 million in total fees to list Tron (TRX), a surprising allegation since Coinbase claims to charge no fees for listing new cryptocurrencies.
Related: Trump-linked crypto ventures may complicate US stablecoin policy
Recent investor disappointment with some token listings may stem from historic profit expectations due to the significant upside of numerous CEX-listed tokens.
Still, the returns of a cryptocurrency after listing depend on the wider market appetite, a Binance spokesperson told Cointelegraph, adding:
“Crypto investors’ expectations for new listings to perform well are understandable and often shaped by the historic success” of CEX listings, added the spokesperson.
Binance, the world’s largest crypto exchange, listed 77 cryptocurrencies throughout 2023 and 2024, with a 0% delisting rate.
Binance announced a community voting mechanism for token listings on March 9, to make the listing process more decentralized.
Magazine: Memecoins are ded — But Solana ‘100x better’ despite revenue plunge
",2025-04-03 13:47:39.408460,[],,2025-04-03T13:47:39.408460
18685324be3310752ea222e37c937be6,Cointelegraph,Bitcoin price risks drop to $71K as Trump tariffs hurt US business outlook,https://cointelegraph.com/news/bitcoin-71k-target-tariffs-deal-rare-us-business-outlook-slump," Bitcoin may see a ""sizeable bounce"" at $71,000 if US trade tariffs result in further BTC price pressure, new analysis predicts. 
Bitcoin (BTC) faces “very high risk” conditions from US trade tariffs, which could spark a slump to $71,000.
In his latest analysis, Charles Edwards, the founder of quantitative Bitcoin and digital asset fund Capriole Investments, warned about the impact of “higher than expected” US trade tariffs.
Bitcoin reacted noticeably worse than US stocks after President Donald Trump announced worldwide reciprocal trade tariffs on April 2.
BTC/USD fell up to 8.5% on the day, while the S&P 500 managed to end the Wall Street trading session 0.7% higher.
Edwards said that US business expectations are reflecting the type of uncertainty seen only three times since the turn of the millennium.
“Consider this as tariffs come in higher than expected. The Philly Fed Business Outlook survey is showing expectations today comparable to 2000, 2008 and 2022,” he told X followers.
An accompanying chart showed the Philadelphia Fed’s Business Outlook Survey (BOS) back under 15 for the first time since the start of 2024. Late 2022 was the pit of the most recent crypto bear market when BTC/USD reversed at $15,600.
Philadelphia Fed Business Outlook Survey vs. S&P 500. Source: Charles Edwards/X
In Capriole’s latest market update on March 31, Edwards acknowledged that BOS data can produce unreliable signals regarding market sentiment but argued that it should not be ignored.
“While no guarantee of the future outlook (this metric does have false signals) this is a data reading we have had before at very high risk zones (year 2000, 2008 and 2022), telling us to keep a very open mind,” he wrote, adding: 
For Bitcoin, a key level to watch in the tariff aftermath is $91,000, with Capriole suggesting that US macroeconomic moves would “decide the ultimate technical trend from here.”
“All else equal, a daily close above $91K would be a strong bullish reclaim signal,” the update explained alongside the weekly BTC/USD chart. 
BTC/USD 1-day chart (screenshot). Source: Capriole Investments
As Cointelegraph reported, a silver lining for crypto and risk assets could come in the form of increasing global liquidity.
Related: Bitcoin sales at $109K all-time high 'significantly below' cycle tops — Glassnode
In the US, the Fed has already begun to loosen tight financial policy, with bets on a return to so-called quantitative easing (QE) varying.
“How long until the Powell printer starts humming?” Edwards queried.
M2 money supply, meanwhile, is due for an “influx,” something which has historically spawned major BTC price upside.
“The BIG takeaway (the most important observation) is that a big M2 influx is coming. The exact date is less important,” analyst Colin Talks Crypto predicted in an X thread this week.
A comparative chart hinted at a potential BTC price rebound by the start of May.
US M2 money supply vs BTC/USD chart. Source: Colin Talks Crypto/X
This article does not contain investment advice or recommendations. Every investment and trading move involves risk, and readers should conduct their own research when making a decision.

",2025-04-03 13:47:43.257957,[],,2025-04-03T13:47:43.257957
3bc2f070255d18ba676f158397602c7b,Cointelegraph,"Alabama, Minnesota lawmakers join US states pushing for Bitcoin reserves",https://cointelegraph.com/news/minnesota-alabama-bitcoin-investment-bills," Bills to create Bitcoin reserves have been introduced in 26 states, with Arizona currently the closest to passing a law. 
Lawmakers in the US states of Minnesota and Alabama filed companion bills to identical existing bills that if passed into law, would allow each state to buy Bitcoin.
The Minnesota Bitcoin Act, or HF 2946, was introduced to the state’s House by Republican Representative Bernie Perryman on April 1, following an identical bill introduced on March 17 by GOP state Senator Jeremy Miller.
Meanwhile, on the same day in Alabama, Republican state Senator Will Barfoot introduced Senate Bill 283, while a bi-partisan group of representatives led by Republican Mike Shaw filed the identical House Bill 482, which allows for the state to invest in crypto, but essentially limits it to Bitcoin (BTC).
Minnesota’s Bitcoin Act would allow the state’s investment board to invest state assets in Bitcoin and other cryptocurrencies and permit state employees to add crypto to retirement accounts.
It would also exempt crypto gains from state income taxes and give residents the option to pay state taxes and fees with Bitcoin.
Source: Bitcoin Laws
The twin Alabama bills don’t explicitly identify Bitcoin, but would limit the state’s crypto investment into assets that have a minimum market value of $750 billion, a criterion that only Bitcoin currently meets.
Introducing identical bills is not uncommon in the US and is typically done to speed up the bicameral legislative process so laws can pass more quickly.
Bills to create a Bitcoin reserve have been introduced in 26 US states, with Arizona currently the closest to passing a law to make one, according to data from the bill tracking website Bitcoin Laws.
Arizona currently leads in the US state Bitcoin reserve race. Source: Bitcoin Laws
Pennsylvania was one of the first US states to introduce a Bitcoin reserve bill, in November 2024. However, the initiative was reportedly eventually rejected, with similar bills also killed in Montana, North Dakota, South Dakota and Wyoming.
Related: North Carolina bills would add crypto to state’s retirement system 
Montana, North Dakota, Pennsylvania, South Dakota and Wyoming are the five states thathave  rejected Bitcoin reserve initiatives. Source: Bitcoin Laws
According to a March 3 report by Barron’s, “red states” like Montana have faced setbacks to the Bitcoin reserve initiatives amid political confrontations between the Democratic Party and the Republican Party.
Additional reporting by Helen Partz.
Magazine: Financial nihilism in crypto is over — It’s time to dream big again


",2025-04-03 13:47:47.042739,[],,2025-04-03T13:47:47.042739
1f5403b3d897ebd73d2096caab34765d,Cointelegraph,Bitcoiner speculates ‘massive’ bot spam briefly took down Bitcoin mailing list,https://cointelegraph.com/news/bitcoiner-speculates-massive-bot-spam-caused-google-briefly-ban-bitcoin-mailing-list," The Bitcoin Development Mailing List on Google Groups was banned for several hours, and one moderator thinks it may have been an intentional attack. 
One of Bitcoin’s key communication tools used to discuss potential protocol changes was knocked out for several hours starting on April 2, with one moderator speculating it may have been a targeted attack assisted by bots. 
For several hours across April 2 and 3, Bitcoin core developers and researchers were unable to interact on Google Groups after Google banned the group for spam. 
“Bitcoin Development Mailing List has been identified as containing spam, malware, or other malicious content,” Google’s warning stated at the time.
The Bitcoin Development Mailing List’s warning before the ban was lifted. Source: Google
Bitcoin Core developer Bryan Bishop told Cointelegraph that the ban may have been triggered by individuals or bots mass-reporting the Bitcoin mailing list from multiple accounts.
It’s a common tactic by attackers looking to ban or censor a community, Bishop said, noting that similar incidents occur on YouTube, X and TikTok fairly often.
Google Workspace Support’s X account confirmed that the issue had been resolved on April 3 at 2:23 am UTC in response to one of the Bitcoin mailing list’s other moderators, Ruben Somsen.
Bitcoin advocate and head of Block Inc, Jack Dorsey, also called attention to the ban, urging Google CEO Sundar Pichai to investigate the issue.
Related: Bitcoin creator Satoshi Nakamoto may be wealthier than Bill GatesMailing lists typically involve one moderator email sending information to subscribers in a group to discuss and collaborate on a topic or shared interest.
The Bitcoin mailing list is used by Bitcoin core developers and researchers to discuss potential protocol changes to Bitcoin, which secures more than $1.6 trillion worth of value for network users around the world.
It has become one of the main Bitcoin mailing lists since the network’s pseudonymous creator, Satoshi Nakamoto, shared Bitcoin’s white paper on the Cryptography Mailing List on Oct. 31, 2008.
Despite the incident, Bishop said the Bitcoin mailing list moderators have no intention of moving away from communicating via email:
The Bitcoin mailing list officially migrated to Google Groups in February 2024. 
Source: Bryan Bishop
Before that, the mailing list was hosted on the Linux Foundation, Oregon State University Open Source Lab’s infrastructure and SourceForge.net.
Bishop suggested that a Bitcoin forum shouldn't be limited to one particular platform, pointing out that there are several other platforms where Bitcoin developments are discussed, including GitHub and the decentralized social network Nostr.
Magazine: 10 crypto theories that missed as badly as ‘Peter Todd is Satoshi’
",2025-04-03 13:47:50.716145,[],,2025-04-03T13:47:50.716145
2845f142c394ba0617e000c04a13c292,Cointelegraph,‘National emergency’ as Trump’s tariffs dent crypto prices,https://cointelegraph.com/news/national-emergency-trump-tariffs-dent-crypto-prices," A crypto investment specialist at crypto asset manager 21Shares told Cointelegraph that while markets experienced significant volatility, the tariff clarity could be a good thing in the long term. 
Crypto markets dipped after US President Donald Trump's declaration of a national emergency and sweeping tariffs on all countries as part of his latest salvo in the ongoing trade war. 
The Trump administration has hit all countries with a 10% tariff starting April 5, with some countries facing even larger rates, such as China facing a 34% tariff, the European Union 20%, and Japan 24%. 
During an April 2 speech in the Rose Garden at the White House, Trump said the US is charging countries “approximately half of what they are and have been charging us.”
🚨 @POTUS signs an Executive Order instituting reciprocal tariffs on countries throughout the world.It's LIBERATION DAY in America! pic.twitter.com/p7UnfE617B
The crypto market briefly went up at the news of a 10% sweeping tariff,  but once the full scope became known, it dipped with bleeding across the board. 
Bitcoin (BTC) had been staging a rally, reaching a session high at $88,500 but dropped 2.6% back to around $82,876. Meanwhile, CoinGecko data shows Ether (ETH) dropped over 6% from $1,934 to $1,797 following the tariff announcements and the total crypto market cap dropped 5.3% to $2.7 trillion. 
The Crypto Fear & Greed Index, which measures market sentiment for Bitcoin and other cryptocurrencies, returned a score of 25, classed as extreme fear, in its latest April 2 update. 
However, prices have clawed back some losses since. Bitcoin has recovered 0.8% to $83,205. While Ether regained 1.2% to take back $1,810.
The crypto Fear & Greed Index score has returned an average rating of fear for the last week but has now dipped to extreme fear. Source: Alternative.me
Stock markets didn't fare much better; trading resource The Kobeissi Letter said in an April 2 post to X that the stock market index S&P 500 erased over $2 trillion in market cap, working out to be roughly $125 billion per minute.
Rachael Lucas, a crypto analyst at Australian crypto exchange BTC Markets, said the brief surge was a case of “uncertainty relief,”  then a sell-off as the full tariff details were released. 
“On BTC Markets, trading volume surged 46% as local traders scrambled to reposition. Big players took profit on the spike, while smaller investors hesitated,” she said in a statement. 
Source: Daan Crypto Trades
She added that if China or the European Union “hit back hard,” expect another round of panic selling.
US Treasury Secretary Scott Bessent urged US trading partners in an April 2 interview with Bloomberg against taking retaliatory steps, arguing “this is the high end of the number” for tariffs if they don't try to add more levies in response, which could provide a “ceiling” and certainty for markets.
David Hernandez, a crypto investment specialist at crypto asset manager  21Shares, told Cointelegraph that markets experienced significant volatility during Trump’s speech, but the clarity could be a good thing in the long term. 
“Although the tariff rates were slightly higher than expectations, the announcement provided much-needed clarity on the scope and scale of the policy,” he said.
Related: 70% chance of crypto bottoming before June amid trade fears: Nansen
“Markets thrive on certainty, and with speculation now largely removed, institutional investors may see an opportunity over the coming days to take advantage of compressed valuations.”
Hernandez says global responses will be key for the market going forward, speculating that Mexico and key East Asian economies, including China, South Korea, and Japan, could be evaluating countermeasures.
Magazine: Financial nihilism in crypto is over — It’s time to dream big again
",2025-04-03 13:47:54.088702,[],,2025-04-03T13:47:54.088702
7b425f3a263b6e035d96eec9ce4978cb,Cointelegraph,Bitcoin price rally to $88.5K obliterates bears as spot volumes soar — Will a tariff war stop the party?,https://cointelegraph.com/news/bitcoin-rally-to-88-5-k-obliterates-bears-as-spot-volumes-soar-will-a-tariff-war-stop-the-party," Bitcoin rallied for a second day as spot volumes soared, but geopolitics and a global tariff war could put a lid on BTC’s price upside. 
Bitcoin price caught an unexpected bid by rallying to a session high at $88,500, but will the price gains be capped at a multimonth overhead resistance that is aligned with the 50-day moving average? 
Key points:
Bitcoin extended its April. 1 gains as news that the Trump administration had not finalized its “Liberation Day” tariffs emerged. 
Israel, Mexico and India have already rolled back their tariffs on US imports or suggested that they will not do “tit for tat” tariffs in response to the expected April 2 US tariffs. 
Bitcoin (BTC) trades slightly below a 3-month descending trendline resistance where the price has consistentlybeen rejected during past rallies. 
Total market liquidations over the past 12-hour trading period have reached $145 million, with $69.4 million of the figure being Bitcoin shorts.  
Data from Kingfisher, CoinGlass and Velo show short liquidations playing a role in today’s push above $88,500. 
Crypto market liquidations in the past 12-hours. Source. CoinGlass 
For the past few months, Bitcoin price has struggled to hold the gains accrued from rallies driven by leverage. Looking beyond futures markets, there are some positives that suggest that the market structure is slowly transitioning from bearish to bullish. 
As shown in the chart below, recent rallies were accompanied by a strong bid in the spot market and the return of the Coinbase Pro premium, leading some analysts to speculate that the shift was influenced by buying from Strategy and other companies focused on building Bitcoin reserves. 
Coinbase premium index. Source: CryptoQuant
Over the last two weeks, GameStop, MARA, Metaplanet and Strategy all announced plans to buy more Bitcoin, with GameStop being on the verge of purchasing and Strategy actively adding to its BTC position. 
GameStop secures $1.5B for possible BTC purchase. Source: Arkham
In the short-term, sustained spot buy volumes at Binance and Coinbase Pro, and the crypto and equities markets’ response to President Donald Trump’s “Liberation Day” tariffs are likely to be the most impactful factors that will influence the current bullish momentum seen in Bitcoin price.  
Related: Bitcoin price on verge of breaking 10-week downtrend — Is $90K BTC next?
This article does not contain investment advice or recommendations. Every investment and trading move involves risk, and readers should conduct their own research when making a decision.
",2025-04-03 13:47:57.491726,[],,2025-04-03T13:47:57.491726
3646b3a6fd4593a23065156ab4dba471,Cointelegraph,West Virginia's BTC reserve bill is 'freedom' from a CBDC — State Senator,https://cointelegraph.com/news/west-virginia-s-btc-reserve-bill-freedom-from-a-cbdc-state-senator," West Virginia's Bitcoin bill seeks to allow the state treasurer to invest up to 10% of state funds in BTC, stablecoins and precious metals. 
West Virginia’s Bitcoin (BTC) strategic reserve bill would give the state more sovereignty from the federal government and freedom from a potential central bank digital currency (CBDC), State Senator Chris Rose told Cointelegraph in an exclusive interview.
“You hear these rumors that there are people at the federal government that will want to have a central bank digital currency,” Rose said. “And people don’t want that. People want decentralized currency. They want freedom.”
The bill, introduced in February, seeks to allow the state treasury to invest up to 10% of public funds in precious metals like gold and silver, stablecoins, or any digital asset that has had a $750 million market capitalization or higher over the last 12 months. Currently, the only digital asset with such a market cap is Bitcoin.
West Virginia State Senator Chris Rose. Source: Cointelegraph
Rose, the bill's sponsor, said that the reason they decided on the market cap requirement was to allow the state to have exposure to cryptocurrency, but not to get trapped “in any things like memecoins.”
Adopting Bitcoin on the state level would “give us a little more state sovereignty,” Rose added. “And I think that’s one reason why you see a lot of people who normally buy [Bitcoin] for themselves want to see their state government do the same.”
He added that a 10% allocation of state funds would be a “good way to introduce [Bitcoin] to the state” while avoiding any fear from people who don’t understand digital assets. “It’s a good way to cap that where they feel comfortable, but also give us at least a decent exposure as well.”
Rose said that one of the roadblocks to getting the bill passed is fear, in particular among those who don't understand cryptocurrency. “Just like any other state, we have people who understand it. We also have people that don’t understand it, and people are always afraid of what they don’t know.”
He added that “once they understand it, they realize it’s a very powerful investment tool and freedom tool for every one of us to adopt.”
Excerpt of West Virginia Bitcoin reserve bill. Source: West Virginia Legislature
West Virginia Governor Patrick Morrisey, who has envisioned a future state economy powered by crypto and other tech, won’t be a roadblock, Rose said. And the state treasurer, whom Rose consulted before introducing the bill, won’t either.
However, according to WVNews, a West Virginia publication, some lawmakers and financial experts remain skeptical. Investing state funds into Bitcoin may be risky due to the asset’s volatility and price swings, which can cause financial instability and make Bitcoin a controversial choice for state investments.
Although Bitcoin strategic reserve bills have been popping up in state legislatures around the United States, some bills have failed to pass or have scrapped key provisions, including some of those in traditionally conservative states.
Currently, 47 strategic Bitcoin reserve bills have been introduced in 26 states according to Bitcoin Laws. While, in most of the states, the bills have only been introduced or referred to committees, some have made headway in three: Arizona, Oklahoma, and Texas.
Related: Texas Senate passes Bitcoin strategic reserve bill
Rose clarified that the 10% of state funds allocated to precious metals, stablecoins, or Bitcoin would be sourced from two key areas.
“It would be the assets under the pensions fund and under the severance tax fund,” Rose said. “They would be able to divest some of those ETF funds into these assets. We wanted to keep it separate from the petty cash fund, which is day-to-day, just paying the bills of the state. We wanted to keep it to our longer-term assets,” he added.
Magazine: X Hall of Flame, Benjamin Cowen: Bitcoin dominance will fall in 2025
",2025-04-03 13:48:00.800575,[],,2025-04-03T13:48:00.800575
